text,location,friends_count,followers_count,screen_name,retweet_count,favorite_count,label,description
"Instagram and Twitter say they have restricted the accounts of US rapper #KanyeWest over posts slammed as anti-Semitic.

Read the full story ➡️  ",France,606,2412700,AFP,19,47,truth,Top news and features from AFP's reporters around the world. Elsewhere on Twitter: https://t.co/ELSlBpSrHN
#BREAKING Macron says Russian strikes signal 'profound change' in Ukraine war ,France,606,2412700,AFP,268,1059,truth,Top news and features from AFP's reporters around the world. Elsewhere on Twitter: https://t.co/ELSlBpSrHN
"A US trio including ex-Federal Reserve chief Ben Bernanke, who played a key role battling the 2008 financial crisis, won the economics Nobel on Monday for research on banks in times of turmoil.
",France,606,2412700,AFP,6,17,truth,Top news and features from AFP's reporters around the world. Elsewhere on Twitter: https://t.co/ELSlBpSrHN
"#UPDATE Belarusian leader Alexander Lukashenko, an ally of Russian President Vladimir Putin, said Monday that Lithuania, Poland and Ukraine were training Belarusian ""radicals"" for terror attacks, after announcing plans to deploy joint troops with Moscow. ",France,606,2412700,AFP,74,122,truth,Top news and features from AFP's reporters around the world. Elsewhere on Twitter: https://t.co/ELSlBpSrHN
"#BREAKING Lukashenko says Lithuania, Poland, Ukraine training Belarusian 'radicals' for terror attacks ",France,606,2412700,AFP,59,120,truth,Top news and features from AFP's reporters around the world. Elsewhere on Twitter: https://t.co/ELSlBpSrHN
"#BREAKING NATO chief condemns ""Russia's horrific and indiscriminate attacks on civilian infrastructure in Ukraine ",France,606,2412700,AFP,84,237,truth,Top news and features from AFP's reporters around the world. Elsewhere on Twitter: https://t.co/ELSlBpSrHN
"#UPDATE ""No, Putin was not 'provoked' to unleash missile terror by (a blast on the) Crimea Bridge... Putin is desperate because of battlefield defeats and uses missile terror to try to change the pace of war in his favour,"" Ukraine's Foreign Minister Dmytro Kuleba said Monday. ",France,606,2412700,AFP,105,326,truth,Top news and features from AFP's reporters around the world. Elsewhere on Twitter: https://t.co/ELSlBpSrHN
#BREAKING Ukraine's Kuleba says Putin 'desperate because of battlefield defeats' ,France,606,2412700,AFP,38,112,truth,Top news and features from AFP's reporters around the world. Elsewhere on Twitter: https://t.co/ELSlBpSrHN
"VIDEO: President Volodymyr Zelensky says Russia targeted Ukraine's energy infrastructure during strikes on several Ukrainian cities on Monday, including using Iran-made drones. ",France,606,2412700,AFP,432,889,truth,Top news and features from AFP's reporters around the world. Elsewhere on Twitter: https://t.co/ELSlBpSrHN
"An ✍️ interview with Nora Felder - the woman that made ""Running Up That Hill"" the unlikely summer smash through #StrangerThings
",France,606,2412700,AFP,6,20,truth,Top news and features from AFP's reporters around the world. Elsewhere on Twitter: https://t.co/ELSlBpSrHN
"Protesters in #Iran remained defiant in the fourth week of a movement against the Islamic republic despite a crackdown including the use of tear gas in Tehran and reports Monday of heavy weaponry used in the Kurdish-populated northwest.
",France,606,2412700,AFP,42,55,truth,Top news and features from AFP's reporters around the world. Elsewhere on Twitter: https://t.co/ELSlBpSrHN
"#UPDATE Heatwaves will become so extreme in certain regions of the world within the coming decades that human life there will be unsustainable, the #UN and #RedCross said Monday. ",France,606,2412700,AFP,47,63,truth,Top news and features from AFP's reporters around the world. Elsewhere on Twitter: https://t.co/ELSlBpSrHN
"#UPDATE Russia's former president Dmitry Medvedev said Monday Russia's retaliatory mass strikes across Ukraine were only the ""first episode"".

""The first episode has been played. There will be others."" ",France,606,2412700,AFP,127,216,truth,Top news and features from AFP's reporters around the world. Elsewhere on Twitter: https://t.co/ELSlBpSrHN
#BREAKING Russian ex-president says Ukraine strikes only 'first episode' ,France,606,2412700,AFP,42,95,truth,Top news and features from AFP's reporters around the world. Elsewhere on Twitter: https://t.co/ELSlBpSrHN
#UPDATE Ukraine on Monday accused Moscow of using Iranian-made drones sent from neighbouring Belarus as part of multiple deadly strikes that Russian forces launched across #Ukraine ,France,606,2412700,AFP,72,125,truth,Top news and features from AFP's reporters around the world. Elsewhere on Twitter: https://t.co/ELSlBpSrHN
"Here is what we know on North Korea's recent spate of ""tactical nuclear"" drills that state media said showed the country's nuclear combat forces were ""fully ready to hit and wipe out"" the enemy.
know:",France,606,2412700,AFP,17,20,truth,Top news and features from AFP's reporters around the world. Elsewhere on Twitter: https://t.co/ELSlBpSrHN
#BREAKING President Vladimir Putin on Monday confirmed Russian forces carried out a wave of missile attacks on #Ukraine cities that killed at least five people and knocked out energy infrastructure nationwide. ,France,606,2412700,AFP,50,66,truth,Top news and features from AFP's reporters around the world. Elsewhere on Twitter: https://t.co/ELSlBpSrHN
#BREAKING Russia targeting civilians 'amounts to a war crime': EU ,France,606,2412700,AFP,97,293,truth,Top news and features from AFP's reporters around the world. Elsewhere on Twitter: https://t.co/ELSlBpSrHN
#BREAKING Putin says response to more Ukrainian attacks will be 'severe' ,France,606,2412700,AFP,102,222,truth,Top news and features from AFP's reporters around the world. Elsewhere on Twitter: https://t.co/ELSlBpSrHN
"#UPDATE The Kremlin said on Monday that a huge missile salvo across #Ukraine launched by its forces was within the framework of what Russia calls its ""special military operation"" in Ukraine. ",France,606,2412700,AFP,60,148,truth,Top news and features from AFP's reporters around the world. Elsewhere on Twitter: https://t.co/ELSlBpSrHN
"#UPDATE G7 leaders and Ukrainian President Zelensky will hold emergency talks on Tuesday to discuss the latest Russian attacks on Ukraine, Berlin said. Chancellor Olaf Scholz has assured Zelensky ""of the solidarity of Germany and the other G7 states"". ",France,606,2412700,AFP,118,275,truth,Top news and features from AFP's reporters around the world. Elsewhere on Twitter: https://t.co/ELSlBpSrHN
"#UPDATE Power outages were reported in several regions across Ukraine following multiple Russian strikes on Monday morning that targeted energy infrastructure, Ukrainian regional officials said. 
📸 Vehicles destroyed in Kyiv on October 10 ",France,606,2412700,AFP,35,66,truth,Top news and features from AFP's reporters around the world. Elsewhere on Twitter: https://t.co/ELSlBpSrHN
"#BREAKING Heatwaves will make entire regions uninhabitable within decades: UN, Red Cross ",France,606,2412700,AFP,80,132,truth,Top news and features from AFP's reporters around the world. Elsewhere on Twitter: https://t.co/ELSlBpSrHN
"#BREAKING G7 leaders, Zelensky to discuss Ukraine developments on Tuesday: Berlin ",France,606,2412700,AFP,75,270,truth,Top news and features from AFP's reporters around the world. Elsewhere on Twitter: https://t.co/ELSlBpSrHN
#BREAKING Power cuts reported in several Ukraine regions after attacks: officials ,France,606,2412700,AFP,20,63,truth,Top news and features from AFP's reporters around the world. Elsewhere on Twitter: https://t.co/ELSlBpSrHN
"""The destruction of Taiwan's democracy and freedom would be a grave defeat for the world's democracies"". 
Taiwan's leader warns Beijing that the island will never give up in a national day speech, drawing parallels with Russia's invasion of #Ukraine
",France,606,2412700,AFP,25,71,truth,Top news and features from AFP's reporters around the world. Elsewhere on Twitter: https://t.co/ELSlBpSrHN
"#UPDATE Belarusian President Alexander Lukashenko, a close ally of Russian leader Vladimir Putin, claimed Monday that Ukraine was preparing an attack on his country's territory. 
""We have agreed to deploy a regional grouping of the Russian Federation and the Republic of Belarus"" ",France,606,2412700,AFP,272,495,truth,Top news and features from AFP's reporters around the world. Elsewhere on Twitter: https://t.co/ELSlBpSrHN
"#BREAKING Russia, Belarus to deploy joint regional troops: Lukashenko ",France,606,2412700,AFP,432,578,truth,Top news and features from AFP's reporters around the world. Elsewhere on Twitter: https://t.co/ELSlBpSrHN
#BREAKING Lukashenko accuses Ukraine of preparing an attack on Belarus ,France,606,2412700,AFP,344,696,truth,Top news and features from AFP's reporters around the world. Elsewhere on Twitter: https://t.co/ELSlBpSrHN
"#UPDATE The city of Lviv in western Ukraine was hit with electricity and hot water cuts after bombardments that targeted critical infrastructure, including energy facilities, Lviv mayor Andriy Sadovyi said Monday. ",France,606,2412700,AFP,36,47,truth,Top news and features from AFP's reporters around the world. Elsewhere on Twitter: https://t.co/ELSlBpSrHN
"RT @ABC: ""This is not a strategic target. This is not a military target. This is a clear message of terror from Pres. Putin.""

@BrittClenne…",New York,440,1634766,ABCWorldNews,90,0,truth,The official Twitter account for @ABC's World News Tonight with @DavidMuir.
"The all-new @ABC News app is here!

Download now to get the all-new features like dark mode and personalized alerts for the topics you care about most:  ",New York,440,1634766,ABCWorldNews,1,2,truth,The official Twitter account for @ABC's World News Tonight with @DavidMuir.
Jury selection begins in Los Angeles for the sexual assault trial of disgraced film producer Harvey Weinstein. ,New York,440,1634766,ABCWorldNews,6,7,truth,The official Twitter account for @ABC's World News Tonight with @DavidMuir.
"NEW: Pres. Biden condemns missile strikes across Ukraine ordered by Russian President Vladimir Putin, saying the attacks “only further reinforce our commitment to stand with the people of Ukraine for as long as it takes.”  ",New York,440,1634766,ABCWorldNews,13,38,truth,The official Twitter account for @ABC's World News Tonight with @DavidMuir.
"A 2-year-old boy has been reunited with his parents after a suspected carjacking in Michigan, thanks to the teamwork of two school bus drivers. ",New York,440,1634766,ABCWorldNews,3,20,truth,The official Twitter account for @ABC's World News Tonight with @DavidMuir.
The San Antonio Police Department fired a police officer after bodycam footage showed him shooting a teenager in a McDonald's parking lot in Texas. ,New York,440,1634766,ABCWorldNews,7,14,truth,The official Twitter account for @ABC's World News Tonight with @DavidMuir.
"There were 300,000 fewer COVID deaths and 650,000 fewer hospitalizations among seniors because of vaccines, according to a new HHS report. ",New York,440,1634766,ABCWorldNews,10,35,truth,The official Twitter account for @ABC's World News Tonight with @DavidMuir.
"Some of the nation's largest airports have been targeted for cyberattacks by an attacker within the Russian Federation, a senior official briefed confirms to @ABC News. ",New York,440,1634766,ABCWorldNews,8,15,truth,The official Twitter account for @ABC's World News Tonight with @DavidMuir.
North Korea released images of the country's leader Kim Jong Un overseeing a missile launch. North Korea says its recent barrage of missile launches were tests of its tactical nuclear weapons to “hit and wipe out” potential South Korean and U.S. targets.  ,New York,440,1634766,ABCWorldNews,9,8,truth,The official Twitter account for @ABC's World News Tonight with @DavidMuir.
"Individual travelers will be able to visit Japan without visas beginning on Tuesday, just like in pre-COVID-19 times, and electronics stores, airlines and various tourists spots have big hopes for a revival of their businesses. ",New York,440,1634766,ABCWorldNews,6,21,truth,The official Twitter account for @ABC's World News Tonight with @DavidMuir.
"Experts have described the pandemic as a kind of ""perfect storm"" in negatively impacting mental health. ",New York,440,1634766,ABCWorldNews,4,7,truth,The official Twitter account for @ABC's World News Tonight with @DavidMuir.
"BATTLE FOR CONTROL OF CONGRESS: Four weeks until the critical midterm elections, prominent Republicans are standing behind former football star and Senate candidate Herschel Walker despite the abortion controversy. @maryaliceparks has more.  ",New York,440,1634766,ABCWorldNews,4,7,truth,The official Twitter account for @ABC's World News Tonight with @DavidMuir.
"“As soon as we launch the drone the Russians are hunting for us."" ",New York,440,1634766,ABCWorldNews,8,14,truth,The official Twitter account for @ABC's World News Tonight with @DavidMuir.
"RT @GMA: ""We were also woken up this morning by the sound of multiple strikes ... these strikes have not targeted military sites, they've t…",New York,440,1634766,ABCWorldNews,35,0,truth,The official Twitter account for @ABC's World News Tonight with @DavidMuir.
"UKRAINE LATEST: Russian President Putin said Monday’s attacks on civilian areas across Ukraine were a response to Saturday’s attack on the bridge connecting Russia and Crimea. At least eight people were killed and 24 injured in Kyiv, officials said. ",New York,440,1634766,ABCWorldNews,5,15,truth,The official Twitter account for @ABC's World News Tonight with @DavidMuir.
"The Nobel Prize in economics was awarded to Ben Bernanke, Douglas W. Diamond and Philip H. Dybvig on Monday for their research on banks and financial crises. ",New York,440,1634766,ABCWorldNews,3,18,truth,The official Twitter account for @ABC's World News Tonight with @DavidMuir.
Football fans packed the stands for Pewaukee High School's homecoming game in Wisconsin. One player changed the game. Senior Ava Matz took the first snap of the game as starting quarterback. @linseydavis reports.  ,New York,440,1634766,ABCWorldNews,13,38,truth,The official Twitter account for @ABC's World News Tonight with @DavidMuir.
"The FBI have joined the urgent search for 20-month-old Quinton Simon who was last seen Wednesday morning at his home in Savannah, Georgia. Officials say they’re working 18 to 20 hour days in hopes of finding him alive. @reporterfaith has more.  ",New York,440,1634766,ABCWorldNews,16,30,truth,The official Twitter account for @ABC's World News Tonight with @DavidMuir.
"A San Antonio police officer has been fired after body camera video footage showed him shooting an unarmed 17-year old, who had been eating fast food in a parking lot and drove away after the officer opened his car door.  @Zohreen has more.  ",New York,440,1634766,ABCWorldNews,21,34,truth,The official Twitter account for @ABC's World News Tonight with @DavidMuir.
"The N.F.L and Players’ Union said the amended protocols, which first took effect during Sunday’s games, will now prohibit a player from returning to play if he shows signs of impaired balance, coordination, or dysfunctional speech. @lipoftv has more.  ",New York,440,1634766,ABCWorldNews,10,26,truth,The official Twitter account for @ABC's World News Tonight with @DavidMuir.
Football fans packed the stands for Pewaukee High School's homecoming game in Wisconsin. One player changed the game. Senior Ava Matz took the first snap of the game as starting quarterback. @LinseyDavis reports.  ,New York,440,1634766,ABCWorldNews,10,40,truth,The official Twitter account for @ABC's World News Tonight with @DavidMuir.
"Anti-government protests are spreading in Iran, as hackers successfully infiltrated the airways by interrupting a newscast for several seconds with a message in solidarity with the protestors calling for people to join and rise up. Lama Hasan reports.  ",New York,440,1634766,ABCWorldNews,63,205,truth,The official Twitter account for @ABC's World News Tonight with @DavidMuir.
"Putin called the massive explosion that damaged a critical bridge connecting Russia to Crimea, a ""terrorist act"" and blamed Ukraine. As @brittclennett reports, Putin's accusation comes just hours after Russian forces attacked civilian targets in Ukraine.  ",New York,440,1634766,ABCWorldNews,17,25,truth,The official Twitter account for @ABC's World News Tonight with @DavidMuir.
#WorldNewsTonight with @LinseyDavis starts in 5 minutes. RT if you're watching! ,New York,440,1634766,ABCWorldNews,9,23,truth,The official Twitter account for @ABC's World News Tonight with @DavidMuir.
California Gov. Gavin Newsom will call a special session of the state Legislature to pass a new tax on oil companies. ,New York,440,1634766,ABCWorldNews,10,31,truth,The official Twitter account for @ABC's World News Tonight with @DavidMuir.
"The man who allegedly left two dead and six injured after he went on a stabbing spree in Las Vegas ""had every intention"" of killing the victims, one of the survivors told @ABC News. ",New York,440,1634766,ABCWorldNews,10,21,truth,The official Twitter account for @ABC's World News Tonight with @DavidMuir.
A boy ran onto the field and was tackled hard by a security guard in the second quarter of Tampa Bay’s game against Atlanta on Sunday. ,New York,440,1634766,ABCWorldNews,7,13,truth,The official Twitter account for @ABC's World News Tonight with @DavidMuir.
"CT Sen. Chris Murphy on Sunday called for a change in Washington's ties to Saudi Arabia after the country and other members of the OPEC+ alliance decided to cut production later this year, a move that will likely drive up the slumping cost of crude oil. ",New York,440,1634766,ABCWorldNews,4,25,truth,The official Twitter account for @ABC's World News Tonight with @DavidMuir.
"Several hundred people on Saturday joined an LGBTQ pride march in Montenegro, held amid strong opposition from the influential Serbian Orthodox Church in the small conservative Balkan country. ",New York,440,1634766,ABCWorldNews,7,25,truth,The official Twitter account for @ABC's World News Tonight with @DavidMuir.
It's possible Florida school shooter Nikolas Cruz talked himself into a death sentence. ,New York,440,1634766,ABCWorldNews,7,13,truth,The official Twitter account for @ABC's World News Tonight with @DavidMuir.
"Hurricane Julia hit Nicaragua's central Caribbean coast on Sunday after lashing Colombia's San Andres island, and a weakened storm was expected to emerge over the Pacific. ",New York,440,1634766,ABCWorldNews,14,25,truth,The official Twitter account for @ABC's World News Tonight with @DavidMuir.
Paweenuch Supholwong sits on her mother’s lap as her mother tells the remarkable story of how the 3-year-old wisp of a girl survived Thailand’s worst mass killing — the only child to emerge unscathed from a day care. ,New York,440,1634766,ABCWorldNews,5,27,truth,The official Twitter account for @ABC's World News Tonight with @DavidMuir.
"Pres. Biden's warning of possible ""Armageddon"" wasn't about an imminent threat, a top Biden spokesperson said. ",New York,440,1634766,ABCWorldNews,4,17,truth,The official Twitter account for @ABC's World News Tonight with @DavidMuir.
Floridians whose homes and businesses were destroyed during Hurricane Ian are adamant about rebuilding the communities that were destroyed during Hurricane Ian. ,New York,440,1634766,ABCWorldNews,5,8,truth,The official Twitter account for @ABC's World News Tonight with @DavidMuir.
"Pope Francis has denounced Europe's treatment of migrants as as “disgusting, sinful and criminal.” ",New York,440,1634766,ABCWorldNews,5,29,truth,The official Twitter account for @ABC's World News Tonight with @DavidMuir.
Five tribes on California's coast are moving forward in their efforts to protect marine ecosystems as part of the Tribal Marine Stewards Network. ,New York,440,1634766,ABCWorldNews,8,20,truth,The official Twitter account for @ABC's World News Tonight with @DavidMuir.
"Emergency workers pull a woman from a wreckage following strikes in Zaporizhzhia, Ukraine. 
",New York,440,1634766,ABCWorldNews,4,6,truth,The official Twitter account for @ABC's World News Tonight with @DavidMuir.
"LATEST: At least 12 people were killed overnight in missile strikes on residential Zaporizhzhia neighborhoods, Zaporizhzhia's governor says.

LIVE UPDATES:
",New York,440,1634766,ABCWorldNews,4,11,truth,The official Twitter account for @ABC's World News Tonight with @DavidMuir.
"Pres. Biden’s warning last week that Vladimir Putin was ""not joking"" about possibly using nuclear weapons was ""concerning"" and counterproductive to bringing an end to Russia's invasion of Ukraine, retired Adm. Mike Mullen said.
",New York,440,1634766,ABCWorldNews,5,12,truth,The official Twitter account for @ABC's World News Tonight with @DavidMuir.
Israeli police say a Palestinian gunman has seriously wounded two people after opening fire at an Israeli military checkpoint in east Jerusalem. ,New York,440,1634766,ABCWorldNews,4,16,truth,The official Twitter account for @ABC's World News Tonight with @DavidMuir.
"The Florida Department of Transportation began soliciting bids to fly migrants to cities including Boston and Los Angeles starting in July, according to documents obtained by @ABC News. ",New York,440,1634766,ABCWorldNews,11,18,truth,The official Twitter account for @ABC's World News Tonight with @DavidMuir.
Authorities say 10 people have been killed in an explosion that destroyed a gas station in a small village in northwest Ireland. ,New York,440,1634766,ABCWorldNews,6,15,truth,The official Twitter account for @ABC's World News Tonight with @DavidMuir.
"Restrictive abortion laws were temporarily struck down Friday in Ohio and Arizona, two states where abortion services have been in flux in the wake of Roe v. Wade being overturned. ",New York,440,1634766,ABCWorldNews,12,39,truth,The official Twitter account for @ABC's World News Tonight with @DavidMuir.
Ukrainian authorities are just beginning to sift through the wreckage of the devastated city of Lyman in eastern Ukraine. ,New York,440,1634766,ABCWorldNews,9,20,truth,The official Twitter account for @ABC's World News Tonight with @DavidMuir.
"The search for a missing 20-month-old entered its fourth day on Saturday, as police have yet to turn up any sign of the toddler. ",New York,440,1634766,ABCWorldNews,8,15,truth,The official Twitter account for @ABC's World News Tonight with @DavidMuir.
"Five years after women’s stories about him made the #MeToo movement explode, Harvey Weinstein is going on trial in Los Angeles, where he once was king of the Oscars. ",New York,440,1634766,ABCWorldNews,17,32,truth,The official Twitter account for @ABC's World News Tonight with @DavidMuir.
"Most train services across the U.K. were canceled Saturday as thousands of rail workers staged the latest in a string of strikes over jobs, pay and working conditions. ",New York,440,1634766,ABCWorldNews,6,20,truth,The official Twitter account for @ABC's World News Tonight with @DavidMuir.
"JUST IN: South Korea says North Korea has fired two ballistic missiles toward its eastern waters, the latest in a barrage of weapons tests in recent days. ",New York,440,1634766,ABCWorldNews,21,20,truth,The official Twitter account for @ABC's World News Tonight with @DavidMuir.
Anti-government demonstrations have erupted in several areas across Iran as the most sustained protests in years against a deeply entrenched theocracy entered their fourth week. ,New York,440,1634766,ABCWorldNews,9,23,truth,The official Twitter account for @ABC's World News Tonight with @DavidMuir.
"Three people were shot outside a high school football game Friday in Toledo, Ohio, and their conditions are not life-threatening, according to the Toledo Police Department. ",New York,440,1634766,ABCWorldNews,8,7,truth,The official Twitter account for @ABC's World News Tonight with @DavidMuir.
Can remote workers be forced to keep their webcams on? One employee of a Florida company was fired for turning his off — but a Dutch court has ruled he was dismissed unfairly. ,New York City,2336,1097327,YahooNews,1,2,truth,Top stories. Trusted sources. Your window to the news that matters most to you. Current live events pinned below. Download our app here: https://t.co/aOTqWBhwuB
"Sen. Raphael Warnock responds to allegations made against his Republican opponent Herschel Walker, who is running against him to represent Georgia in the U.S. Senate. ",New York City,2336,1097327,YahooNews,0,3,truth,Top stories. Trusted sources. Your window to the news that matters most to you. Current live events pinned below. Download our app here: https://t.co/aOTqWBhwuB
"For those who lost everything to a natural disaster and even those spared, the anguish can be crushing to return home to find so much gone... ",New York City,2336,1097327,YahooNews,2,3,truth,Top stories. Trusted sources. Your window to the news that matters most to you. Current live events pinned below. Download our app here: https://t.co/aOTqWBhwuB
"Large United Methodist congregations are moving to the exits, including some of the largest in Arkansas, Georgia, Louisiana, Oklahoma and Texas.
",New York City,2336,1097327,YahooNews,3,3,truth,Top stories. Trusted sources. Your window to the news that matters most to you. Current live events pinned below. Download our app here: https://t.co/aOTqWBhwuB
