text,location,friends_count,followers_count,screen_name,retweet_count,favorite_count,label
is that you tome hanks?...how about we keep america hanksless!!!!...,,,"30,956",helen henning,763,4208,rumor
After the dreadful hurricane in Florida @VP  Kamala Harris says that the rebuilding of the infrastructure will be decided by ¡°giving resources based on equity¡± by directing funds to ¡°communities of color.¡±,,,"33,676",David Atherton,198,297,rumor
Heartbreaking! Iranian father who promised to live long enough to dance at his daughter's wedding ends up dancing at her funeral after she was killed by the Iranian morality police for not covering her hair,,,9361,Shukri Hamk,9589,30927,rumor
my dad just sent me this video from Naples Florida Hurricane Ian ,,,29,the worlds foremost authority,933,3681,rumor
Omg so all funerals due on the 19 th have been cancelled !My heartfelt sympathy with all those bereft families involved .,,,"3,924",Carolyn Brown,3381,26141,rumor
BIDEN ADMITS TO VOTER FRAUD! @JoeBiden brags about having the ¡°most extensive VOTER FRAUD organization¡± in history WATCH ,,,"2,775,274",Kayleigh McEnany,20227,46089,rumor
"Troglodyte thinks escalation. Talked about this last week on 
@HedgeyeBREAKING Russian airlines ordered to stop selling tickets to Russian men aged 18 to 65 -",,,"44,468",Michael Taylor,13,92,rumor
Massive protest by Russians in St Petersburg against the war in Ukraine. They are chanting ¡°No to War!¡±,,,21,theivall,1140,3462,rumor
"NEWS: Reps Liz Cheney and Zoe Lofgren have proposed a bill that would prevent Donald Trump from being reinstalled as President.
RT if you support this idea.",,,"500,034",Really American,20414,58418,rumor
"In Brazil, an invasion of crocodiles that have flooded one of the beaches with several hundred, even thousands, and the local population is panicking",,,"898,452",Ken Rutkowski,24194,168604,rumor
"Border btw #Russia - #Finland after #Putin""s partial #mobilization",,,"78,816",C4H10FO2P,167,576,rumor
"Situation at Finland's borders has not changed with the announcement of Russian moilization. There are videos circulating on social media, at least some of which have already been filmed before and now taken out of context. There is incorrect information in circulation.",,,36592,Rajavartiolaitos,1880,5181,rumor
Gov. Greg Abbott and Democratic challenger Beto O¡¯Rourke are making a historic investment in Spanish-language outreach as roughly a fourth of Texas¡¯ eligible voters speak Spanish.,,,"700,267",Houston Chronicle,50,173,rumor
"#Troglodyte thinks escalation.
Talked about this last week on 
@Hedgeye BREAKING Russian airlines ordered to stop selling tickets to Russian men aged 18 to 65 -",,,"44,474",Michael Taylor,13,92,rumor
The National Institute of Health and CDC now say Ivermectin is a drug to be used for Covid-19 (RDV 200 mg IVa on Day 1) Characteristics of Antiviral Agents That Are Approved or Under Evaluation for the Treatment of COVID-19,,,"30,890",Tom Quiggin,13,16,rumor
At  @defcon hacking conference and just learned how easy it is to physically gain admin access on a voting machine that is used in 18 states. Requires no tools and takes under 2 minutes. I¡¯m concerned for our upcoming elections.,,,"88,831",Rachel Tobac,35978,51499,rumor
"BREAKING: D.C. has banned unvaccinated students from attending schools in-person, and does not have a contingency plan for virtual learning. According to city data, over 40% of African Americans ages 12-17 are not vaccinated. This is awful.",,,"522,141",Dr. Simone Gold,5593,118681,rumor
"BREAKING: California Gov. Gavin Newsom considering legislation barring residents from moving to Texas or Florida. ""We can't allow our people to be taken in by promises of freedom and better economic opportunities. They need to stay here,"" a staffer told reporters.",,,"50,728",The Prophet Jeffiziah,6154,23841,rumor
So in Los Angles they just disqualified almost 30% of ballot signatures BUT they expect you to believe that LESS THAN 1% of Ballots were faulty in the 2020 Presidential Election! Give me a fricken break!!!,,,"8,520,349",Donald Trump Jr.,7524,24761,rumor
"BREAKING In order to safeguard democracy, Congress has voted to exempt itself and its members from upcoming IRS audits",,,21523,News That Matters,10822,17849,rumor
NEW: Donald is fundraising by giving us ¡°nuclear codes¡±. This is a fucking joke to him. ,,,"370,670","Mueller, She Wrote",4577,13597,rumor
"Democrats continue to make abortion campaign issue, but most still won't say if they support any restrictions ",U.S.A.,261.0,22411674,FoxNews,2,6,truth
Former DEA official warns parents after fentanyl found disguised in candy packaging: 'It's a mass poisoning' ,U.S.A.,261.0,22411674,FoxNews,62,80,truth
BREAKING NEWS: Hurricane Ian less than 24 hours away from Florida landfall ,U.S.A.,261.0,22411674,FoxNews,52,160,truth
"Buckingham Palace will ‘devise a plan’ to protect King Charles against ‘The Crown,' royal expert says ",U.S.A.,261.0,22411674,FoxNews,7,48,truth
"Texas authorities, FBI arrest woman, juvenile for allegedly kidnapping Florida baby ",U.S.A.,261.0,22411674,FoxNews,8,50,truth
Republicans sound alarm over Chinese government-linked farmland purchase near North Dakota air base ,U.S.A.,261.0,22411674,FoxNews,71,212,truth
White House dodges on Biden snubbing Ron DeSantis ahead of Hurricane Ian landfall ,U.S.A.,261.0,22411674,FoxNews,33,105,truth
Texas AG Ken Paxton fires back at critics over claims he fled home to avoid subpoena ,U.S.A.,261.0,22411674,FoxNews,13,58,truth
New York City Mayor Eric Adams blasted for knocking Kansas when boasting about NY’s ‘brand’ ,U.S.A.,261.0,22411674,FoxNews,31,121,truth
Short-staffed New Orleans police hiring civilians to help amid violent crime surge: 'Alarming to residents' ,U.S.A.,261.0,22411674,FoxNews,35,99,truth
"Biden’s student loan handout ‘has issues’, will encourage people to ‘borrow unwisely’: New York Times writer ",U.S.A.,261.0,22411674,FoxNews,38,135,truth
Mountain lion in California found dead from mange ,U.S.A.,261.0,22411674,FoxNews,15,57,truth
Russia's borders see desperation as draft-eligible men flee ,U.S.A.,261.0,22411674,FoxNews,32,101,truth
Researchers study whether child vaccines and asthma are linked ,U.S.A.,261.0,22411674,FoxNews,37,95,truth
"Texas, Arizona AGs: Border crisis a ‘planned disaster’ by Biden admin, hurting the entire country ",U.S.A.,261.0,22411674,FoxNews,68,242,truth
"Mexican authorities arrest leader of ultra-Orthodox Jewish sect on organized crime, human trafficking charges ",U.S.A.,261.0,22411674,FoxNews,23,69,truth
"Sharon Osbourne on cancel culture: The more you try to defend yourself, the worse you look ",U.S.A.,261.0,22411674,FoxNews,54,266,truth
Libertarian group files lawsuit to block student debt cancellation ,U.S.A.,261.0,22411674,FoxNews,77,607,truth
BRACING FOR IMPACT: Gov. @RonDeSantisFL provides update on federal hurricane assistance as ‘life threatening’ storm surge forces Floridians to evacuate.  ,U.S.A.,261.0,22411674,FoxNews,197,1113,truth
Salon commentary cancels the term 'Latinx' as not inclusive enough ,U.S.A.,261.0,22411674,FoxNews,28,166,truth
Pierce Brosnan reveals Robin Williams improvised an iconic ‘Mrs. Doubtfire’ line ,U.S.A.,261.0,22411674,FoxNews,12,78,truth
LeBron James gets help from Ohio State AD about college eligibility in another sport ,U.S.A.,261.0,22411674,FoxNews,5,29,truth
Mike Pompeo launches new campaign to combat what he says is ‘wokeness in the military’ ,U.S.A.,261.0,22411674,FoxNews,57,445,truth
"Georgia Gov. Kemp opposes changing Atlanta Braves' name, says World Series champs need to ‘keep chopping' ",U.S.A.,261.0,22411674,FoxNews,58,552,truth
"AZ Dept. of Education linked to chat rooms where minors talk sex, gender with adults without parental consent ",U.S.A.,261.0,22411674,FoxNews,64,94,truth
Health officials in Sudan warn of infectious disease outbreak from unidentified bodies ,U.S.A.,261.0,22411674,FoxNews,22,44,truth
Adam Levine and Maroon 5 announce Las Vegas residency amid singer's cheating scandal ,U.S.A.,261.0,22411674,FoxNews,15,57,truth
.@JesseBWatters  calls on Democrats to stop name calling and do something to fix border crisis ,U.S.A.,261.0,22411674,FoxNews,47,277,truth
"WaPo gives Sen. Patty Murray 'Four Pinocchios' for saying Republicans plan to 'end' Social Security, Medicare ",U.S.A.,261.0,22411674,FoxNews,146,367,truth
"Church of Scientology got Tom Cruise a divorce, helped him marry Nicole Kidman, book alleges ",U.S.A.,261.0,22411674,FoxNews,17,50,truth
New York City subway assault victim accuses mayor of breaking promises ,U.S.A.,261.0,22411674,FoxNews,67,200,truth
"Philadelphia bans guns in city rec spaces; even legal permit holders will have ‘problem with me,' DA says ",U.S.A.,261.0,22411674,FoxNews,30,97,truth
"Idaho judge in Lori Vallow, Chad Daybell murder cases bars cameras from courtroom: 'A great risk' ",U.S.A.,261.0,22411674,FoxNews,12,48,truth
Hurricane Ian: Politico falsely claims DeSantis ‘still hasn’t faced’ Florida’s ‘toughest’ challenge ,U.S.A.,261.0,22411674,FoxNews,19,77,truth
BORDER ‘HYPOCRISY’: @JesseWatters blasts former President Obama over claim that ‘fuel’ behind Republican Party is fear of immigrants of ‘darker shades.’ ,U.S.A.,261.0,22411674,FoxNews,145,509,truth
"Hurricane Ian: Emergency phone numbers, apps Florida residents should have ",U.S.A.,261.0,22411674,FoxNews,37,73,truth
ABC News report labels Kyrsten Sinema's support of the Senate filibuster 'controversial' ,U.S.A.,261.0,22411674,FoxNews,20,80,truth
"Pelosi, Schumer push Biden to take tougher stand against Chinese investment ",U.S.A.,261.0,22411674,FoxNews,16,74,truth
"Manchin's energy permitting proposal stripped from funding bill after GOP, progressive opposition ",U.S.A.,261.0,22411674,FoxNews,31,108,truth
US Army fires Javelin anti-tank missiles from robots in key tech test ,U.S.A.,261.0,22411674,FoxNews,25,80,truth
"Cuba struck by Hurricane Ian, leaves 1 million residents without power and streets flooded ",U.S.A.,261.0,22411674,FoxNews,43,87,truth
FDA warning about NyQuil chicken TikTok challenge may have spiked interest ,U.S.A.,261.0,22411674,FoxNews,15,40,truth
.@JesseBWatters  breaks down brutal NYC subway station attack ,U.S.A.,261.0,22411674,FoxNews,21,104,truth
Hurricane Ian evacuation: What to pack ,U.S.A.,261.0,22411674,FoxNews,15,42,truth
"Hurricane Ian forces changes to Florida-Eastern Washington, 2 other college football games ",U.S.A.,261.0,22411674,FoxNews,11,36,truth
"Keith Olbermann recalls dating Sinema, says he’s tired of her ‘act’ as it grew more ‘nightmarish’ as senator ",U.S.A.,261.0,22411674,FoxNews,24,69,truth
"Waukesha accused Christmas parade killer Darrell Brooks squabbles with judge, wants to represent himself ",U.S.A.,261.0,22411674,FoxNews,24,67,truth
Aaron Judge in a club of one after cold streak following 60th home run ,U.S.A.,261.0,22411674,FoxNews,5,36,truth
"Brittney Griner question sparks complete opposite responses from LSU, Baylor coaches ",U.S.A.,261.0,22411674,FoxNews,10,37,truth
"EJ Smith, son of Hall of Famer Emmitt, out for season with injury ",U.S.A.,261.0,22411674,FoxNews,7,45,truth
"A Labour government would create a publicly-owned green energy company to turn UK into clean energy ""superpower"", leader Sir Keir Starmer says ","London, UK",3.0,51216324,BBCBreaking,284,2209,truth
"Either Glasgow or Liverpool will host next year's Eurovision Song Contest, after the shortlist of UK cities in contention was cut to just two ","London, UK",3.0,51216324,BBCBreaking,228,1332,truth
Direct hit! Nasa smashes spacecraft into asteroid in controlled experiment 7 million miles away ,"London, UK",3.0,51216324,BBCBreaking,498,2304,truth
"Bank of England says it will ""not hesitate"" to raise interest rates to curb inflation after the pound fell to a record low against the US dollar ","London, UK",3.0,51216324,BBCBreaking,663,1813,truth
"Gunman opens fire at school in Russian city of Izhevsk, with officials saying at least six people killed and others wounded ","London, UK",3.0,51216324,BBCBreaking,434,1030,truth
The pound plunges to its lowest level against the US dollar - at just over $1.03 - since decimalisation in 1971 ,"London, UK",3.0,51216324,BBCBreaking,1866,4248,truth
Far-right Giorgia Meloni set to win Italy's elections and is on course to become first female PM - exit polls ,"London, UK",3.0,51216324,BBCBreaking,1066,3233,truth
"Two boys, aged 15 and 16, charged with the murder of Khayri McLean, who was stabbed outside a school in Huddersfield ","London, UK",3.0,51216324,BBCBreaking,138,754,truth
"Dame Hilary Mantel, author of the best-selling Wolf Hall trilogy, has died aged 70, her publisher says ","London, UK",3.0,51216324,BBCBreaking,735,1912,truth
"""We need global banks to create jobs here... and pay taxes here in London, not in Paris, not in Frankfurt and not in New York""

Chancellor Kwasi Kwarteng announces UK cap on bankers' bonuses is to be scrapped

 ","London, UK",3.0,51216324,BBCBreaking,108,446,truth
"The cap on UK bankers' bonuses is to be scrapped, Chancellor Kwasi Kwarteng confirms

","London, UK",3.0,51216324,BBCBreaking,150,590,truth
"UK rail workers to strike on 8 October ""effectively shutting down the railway network"", RMT union says ","London, UK",3.0,51216324,BBCBreaking,509,2233,truth
"National Insurance rise will be reversed from 6 November, UK chancellor confirms ahead of Friday's mini-budget ","London, UK",3.0,51216324,BBCBreaking,225,937,truth
"UK interest rates rise to 2.25%, the highest level in 14 years, as Bank of England battles soaring prices
","London, UK",3.0,51216324,BBCBreaking,444,1124,truth
Five British nationals captured by Russian-backed forces in Ukraine have returned to UK ,"London, UK",3.0,51216324,BBCBreaking,201,1922,truth
"Boy, 16, arrested on suspicion of murder after 15-year-old boy stabbed outside school in Huddersfield, UK ","London, UK",3.0,51216324,BBCBreaking,117,651,truth
"British man Aiden Aslin is among those who have been released in a prisoner swap between Ukraine and Russia, UK health minister says
","London, UK",3.0,51216324,BBCBreaking,119,684,truth
"Five British nationals held by Russian-backed forces in eastern Ukraine have been released, says UK PM Liz Truss
","London, UK",3.0,51216324,BBCBreaking,212,1183,truth
"US President Joe Biden says his nation wants Russia's war in Ukraine ""to end on just terms""

 ","London, UK",3.0,51216324,BBCBreaking,257,1428,truth
Donald Trump and three of his children hit by fraud lawsuit after New York investigation into family business ,"London, UK",3.0,51216324,BBCBreaking,849,4683,truth
"""This war is about extinguishing Ukraine's right to exist as a state - plain and simple""

US President Joe Biden says Russia's invasion of Ukraine should make people's ""blood run cold""

 ","London, UK",3.0,51216324,BBCBreaking,362,1695,truth
"""This world should see these outrageous acts for what they are""

Speaking about Russia's invasion of Ukraine, US President Joe Biden says no-one other than Russia sought conflict

 ","London, UK",3.0,51216324,BBCBreaking,319,1655,truth
"US President Joe Biden attacks Russian President Vladimir Putin for ""shamelessly violating"" UN charter with Ukraine invasion ","London, UK",3.0,51216324,BBCBreaking,450,2626,truth
"Reward of up to £200,000 being offered to help catch killer of nine-year-old Olivia Pratt-Korbel
","London, UK",3.0,51216324,BBCBreaking,227,946,truth
Energy bills for most UK firms set to be halved for six months under new government support scheme ,"London, UK",3.0,51216324,BBCBreaking,147,554,truth
"Vladimir Putin accuses West of ""nuclear blackmail"" vowing to use all means at his disposal, as he calls up reservists for Ukraine ","London, UK",3.0,51216324,BBCBreaking,454,1477,truth
"The Queen has been buried following a private ceremony in Windsor, the Royal Family says
","London, UK",3.0,51216324,BBCBreaking,892,10376,truth
"A service of committal begins for Queen Elizabeth II in St George’s Chapel, Windsor where her late husband’s funeral was held ","London, UK",3.0,51216324,BBCBreaking,220,1419,truth
"Crowds line the Long Walk as Queen Elizabeth II's coffin makes its way to St George's Chapel in Windsor Castle
 ","London, UK",3.0,51216324,BBCBreaking,851,3927,truth
Queen Elizabeth II's coffin begins final procession to St George's Chapel in Windsor Castle ,"London, UK",3.0,51216324,BBCBreaking,292,1914,truth
"Funeral procession makes its way down the Mall led by Mounties of the Royal Canadian Mounted Police, who are followed by representatives from the National Health Service 

 ","London, UK",3.0,51216324,BBCBreaking,1001,4237,truth
Queen Elizabeth II's coffin taken towards Wellington Arch following funeral service at Westminster Abbey ,"London, UK",3.0,51216324,BBCBreaking,345,2176,truth
"King Charles III, his sister Princess Anne, and his brothers, Princes Andrew and Edward, as well as Princes William and Harry, follow Queen Elizabeth II's coffin

 ","London, UK",3.0,51216324,BBCBreaking,1113,4420,truth
King Charles III follows Queen Elizabeth II’s coffin as funeral procession leaves for Westminster Abbey ,"London, UK",3.0,51216324,BBCBreaking,361,1797,truth
"As Queen Elizabeth II’s lying-in-state ends, the nation prepares for final farewell ","London, UK",3.0,51216324,BBCBreaking,261,1722,truth
The queue to see the Queen lying in state is closed to new arrivals ,"London, UK",3.0,51216324,BBCBreaking,215,1162,truth
"Prince George and Princess Charlotte to attend the Queen’s funeral, order of service reveals ","London, UK",3.0,51216324,BBCBreaking,432,3944,truth
King Charles says he and Camilla “deeply touched” by messages of support as they prepare to say their last farewell to ,"London, UK",3.0,51216324,BBCBreaking,104,1349,truth
UK to fall silent for one minute at 20:00 BST to remember Queen Elizabeth II ,"London, UK",3.0,51216324,BBCBreaking,443,3313,truth
"Prince Andrew says he will ""treasure forever"" his mother's ""love for a son"" and her compassion and care, in tribute to Queen Elizabeth II ","London, UK",3.0,51216324,BBCBreaking,184,1909,truth
"Queen’s grandchildren take part in a vigil around her coffin, with Prince Harry wearing military uniform ","London, UK",3.0,51216324,BBCBreaking,238,2403,truth
"The King greets people currently queuing to see Queen Elizabeth II's coffin

Latest  ","London, UK",3.0,51216324,BBCBreaking,520,3915,truth
King Charles III and Prince William make surprise appearance to meet those queuing to see the Queen lying in state ,"London, UK",3.0,51216324,BBCBreaking,416,4814,truth
"Queue to see Queen lying in state officially reopens but warning issued of 24-hour wait and cold overnight temperatures 

","London, UK",3.0,51216324,BBCBreaking,308,1796,truth
Entry to queue to see Queen's lying-in-state to be paused for at least six hours after it reaches capacity ,"London, UK",3.0,51216324,BBCBreaking,230,1133,truth
Two police officers taken to hospital after being stabbed in central London ,"London, UK",3.0,51216324,BBCBreaking,500,1528,truth
"Roger Federer, one of the greatest tennis players in history, announces he will retire later this month ","London, UK",3.0,51216324,BBCBreaking,557,2558,truth
"Queen Elizabeth II's state funeral to end with two-minute national silence and more than 2,000 guests will attend

","London, UK",3.0,51216324,BBCBreaking,253,1901,truth
"@BBCWorld Prince William and Kate read notes left by members of the public at Sandringham before shaking hands and chatting with people who have come to pay tribute 

 ","London, UK",3.0,51216324,BBCBreaking,115,828,truth
"William and Kate, the new Prince and Princess of Wales, at Queen's estate in Sandringham to view floral tributes

","London, UK",3.0,51216324,BBCBreaking,191,1948,truth
"Here is how the scale breaks down, according to the National Hurricane Center: ","New York, NY",595.0,8786846,CBSNews,8,12,truth
"Saudi Arabia's King Salman on Tuesday named his powerful son and heir Crown Prince Mohammed bin Salman as prime minister, a position previously held by the king.  ","New York, NY",595.0,8786846,CBSNews,14,32,truth
A U.S. Navy nuclear engineer and his wife entered new guilty pleas Tuesday in a case involving an alleged plot to sell secrets about nuclear-powered warships. ,"New York, NY",595.0,8786846,CBSNews,38,63,truth
The cost of renting an apartment is falling in some U.S. cities after reaching a record high in the first half of 2022. ,"New York, NY",595.0,8786846,CBSNews,4,23,truth
The quality of life of young transmasculine people dramatically improves after receiving top surgery — a mastectomy procedure that removes breast tissue — according to a study by Northwestern Medicine. ,"New York, NY",595.0,8786846,CBSNews,9,46,truth
"Hurricane Ian is gaining strength in the Gulf of Mexico and is expected to hit Florida's west coast late Wednesday as a Category 3 storm, officials said. ","New York, NY",595.0,8786846,CBSNews,14,28,truth
"Mesmerizing imagery shows the intense lightning and size of #HurricaneIan as it moves from Cuba to the Gulf of Mexico. 

📹: Courtesy of Stu Ostro/The Weather Channel ","New York, NY",595.0,8786846,CBSNews,51,85,truth
"Ukraine's President Volodymyr Zelenskyy spoke live by video conference on Tuesday to world powers at the U.N. Security Council, slamming the illegitimate votes that Russia is forcing on citizens in occupied Ukraine.  ","New York, NY",595.0,8786846,CBSNews,23,85,truth
"BREAKING: Hurricane Ian created an ""apocalyptic"" scene in Cuba on Tuesday as it devastated the island's power grid and left 1 million people without electricity. ","New York, NY",595.0,8786846,CBSNews,43,90,truth
"A city in California is considering legislation that would ban abortions within the city. In response, California AG Rob Bonta warned Temecula's city council not to pass such legislation, threatening legal action if it attempts to go above state law.  ","New York, NY",595.0,8786846,CBSNews,14,48,truth
"Hurricane Ian is unleashing brutal conditions in Key West, Florida – even before it's reached the state. 

Where @CBSMiami's @GabrielleArzola is located, the coastline has all but disappeared as an estimated 3-foot storm surge lashes through the streets. ","New York, NY",595.0,8786846,CBSNews,47,146,truth
Disney World announced that it is closing its Florida theme parks and water parks on Wednesday and Thursday as it braces for Hurricane Ian. ,"New York, NY",595.0,8786846,CBSNews,30,75,truth
"The 13 million estimated in the early September survey represents a reduction since June 2021, when an estimated 23 million Americans had insurrectionist sentiment.  ","New York, NY",595.0,8786846,CBSNews,17,31,truth
"""In front of the eyes of the whole world, Russia is conducting this so-called sham referenda on the occupied territory of Ukraine,"" Ukraine's president said.
 ","New York, NY",595.0,8786846,CBSNews,23,102,truth
"A huge wave crashed and overflowed into a swimming pool as Hurricane Ian neared Grand Cayman, Cayman Islands.  ","New York, NY",595.0,8786846,CBSNews,18,61,truth
RT @CBSMornings: Actor George Clooney (@ClooneyFDN) wants to make sure that people in ongoing human rights abuse cases are not forgotten —…,"New York, NY",595.0,8786846,CBSNews,22,0,truth
"RT @CBSMornings: Legendary NASCAR champion @JimmieJohnson is retiring from full-time racing, just two years after making the switch to the…","New York, NY",595.0,8786846,CBSNews,3,0,truth
"RT @CBSMornings: When asked if there should be age limits for serving in public office, @SenSanders, who is 81, said it is more important t…","New York, NY",595.0,8786846,CBSNews,32,0,truth
"RT @CBSMornings: Alec Baldwin and others could soon face criminal charges, as the DA in Santa Fe, New Mexico is weeks “if not days” away fr…","New York, NY",595.0,8786846,CBSNews,4,0,truth
People in Key West take photos next to crashing waves as Hurricane Ian heads towards Florida's west coast.  ,"New York, NY",595.0,8786846,CBSNews,69,176,truth
"Senate Majority Leader Mitch McConnell on Tuesday announced he'll ""proudly"" support bipartisan legislation in the Senate to reform the Electoral Count Act, a move intended to prevent a recurrence of the events of Jan. 6, 2021.  ","New York, NY",595.0,8786846,CBSNews,25,118,truth
"Winds have picked up in Key West as #HurricaneIan creeps closer to Florida. The powerful winds and flooding are just some of the dangers of the situation, but as @CBSMiami's @GabrielleArzola found, it's not stopping some people from walking – and falling – along the pier. ","New York, NY",595.0,8786846,CBSNews,24,72,truth
Police drove through neighborhoods in the Tampa Bay area to alert residents of mandatory evacuation orders as Hurricane Ian approached the state.  ,"New York, NY",595.0,8786846,CBSNews,25,66,truth
"RT @CBSEveningNews: In an exclusive interview, CIA Director Bill Burns told @norahodonnell that U.S. intelligence is evaluating Vladimir Pu…","New York, NY",595.0,8786846,CBSNews,63,0,truth
"The popular comedy group The Try Guys has announced that it is parting ways with Ned Fulmer, one of the group's founding members, after he admitted to an affair with a coworker. ","New York, NY",595.0,8786846,CBSNews,0,9,truth
"RT @CBSEveningNews: On this week’s @CBSSunday, @NorahODonnell sits down exclusively with CIA Director Bill Burns to discuss Vladimir Putin’…","New York, NY",595.0,8786846,CBSNews,13,0,truth
"The remains of a Virginia teenager who disappeared nearly 50 years ago have now been identified, police announced. Authorities involved in the cold case credited advanced DNA tests and ""forensic-grade"" genome sequencing for the recent discovery. ","New York, NY",595.0,8786846,CBSNews,7,37,truth
