text,location,friends_count,followers_count,screen_name,retweet_count,favorite_count,label,description
"RT @CBSMornings: When Charlotte McCourt set out to sell Girl Scout cookies, she used a unique tactic to bring in customers: “Truth in adver…","New York, NY",597,8808966,CBSNews,23,0,truth,"Your source for original reporting and trusted news.

📺 CBS | Streaming on the CBS News app | @ParamountPlus"
"RT @CBSMornings: Former officer Michael Fanone suffered burns, a heart attack and traumatic brain injuries after rioters assaulted him duri…","New York, NY",597,8808966,CBSNews,86,0,truth,"Your source for original reporting and trusted news.

📺 CBS | Streaming on the CBS News app | @ParamountPlus"
RT @CBSMornings: Health officials are warning Americans about an early and long flu season — but less than half of adults plan on getting t…,"New York, NY",597,8808966,CBSNews,19,0,truth,"Your source for original reporting and trusted news.

📺 CBS | Streaming on the CBS News app | @ParamountPlus"
RT @CBSMornings: The latest CBS News-YouGov BattleGround Tracker shows the Senate is essentially a toss-up in next month’s midterms. Each p…,"New York, NY",597,8808966,CBSNews,9,0,truth,"Your source for original reporting and trusted news.

📺 CBS | Streaming on the CBS News app | @ParamountPlus"
"RT @CBSMornings: CBS News obtained first access to audio secretly recorded in June 2021 by former D.C. officer Michael Fanone, who was inju…","New York, NY",597,8808966,CBSNews,709,0,truth,"Your source for original reporting and trusted news.

📺 CBS | Streaming on the CBS News app | @ParamountPlus"
"RT @CBSMornings: Artist and author @OliverJeffers has sold more than 14 million books worldwide, taking readers through captivating stories…","New York, NY",597,8808966,CBSNews,13,0,truth,"Your source for original reporting and trusted news.

📺 CBS | Streaming on the CBS News app | @ParamountPlus"
"Protesters gathered outside the home of Los Angeles City Council President Nury Martinez and called on her to resign on Sunday, after a year-old audio recording emerged of her making racist remarks about a council member's Black son.  ","New York, NY",597,8808966,CBSNews,56,157,truth,"Your source for original reporting and trusted news.

📺 CBS | Streaming on the CBS News app | @ParamountPlus"
Chinese cities are imposing fresh lockdowns and travel restrictions after the number of new daily COVID-19 cases tripled during a weeklong holiday. ,"New York, NY",597,8808966,CBSNews,15,23,truth,"Your source for original reporting and trusted news.

📺 CBS | Streaming on the CBS News app | @ParamountPlus"
"The former chair of the U.S. Federal Reserve Board and two U.S.-based economists get the Nobel Prize in economic sciences for research showing ""why avoiding bank collapses is vital.""  ","New York, NY",597,8808966,CBSNews,13,24,truth,"Your source for original reporting and trusted news.

📺 CBS | Streaming on the CBS News app | @ParamountPlus"
"In a call about a year ago, Nury Martinez, among other things, made a racist remark about a fellow council member's Black son, and now says her comments were made ""in a moment of intense frustration and anger."" ","New York, NY",597,8808966,CBSNews,22,41,truth,"Your source for original reporting and trusted news.

📺 CBS | Streaming on the CBS News app | @ParamountPlus"
"Security camera footage shows the moment a person walking along the Glass Bridge in Kyiv, Ukraine, was nearly hit by a missile. The bridge was one of several areas in Kyiv and other cities struck by Russian forces on Monday morning.  ","New York, NY",597,8808966,CBSNews,51,76,truth,"Your source for original reporting and trusted news.

📺 CBS | Streaming on the CBS News app | @ParamountPlus"
"Almost everyone on board a boat – roughly 85 people – died when it capsized in a flood-swollen river in Nigeria's Anambra state, President Muhammadu Buhari said on Sunday.

 ","New York, NY",597,8808966,CBSNews,6,26,truth,"Your source for original reporting and trusted news.

📺 CBS | Streaming on the CBS News app | @ParamountPlus"
"The surfer, who now has nearly 19 inches of staples, said that after the shark clamped onto his leg and board, he grabbed the shark's body with one hand and kicked at its head with his free leg until it let him go and swam away. ","New York, NY",597,8808966,CBSNews,11,65,truth,"Your source for original reporting and trusted news.

📺 CBS | Streaming on the CBS News app | @ParamountPlus"
"North Korea says Kim Jong Un oversaw the recent missile tests that involved ""tactical nuclear"" drills to simulate hitting the South and that the drills were a response to U.S.-led joint military exercises in the region. ","New York, NY",597,8808966,CBSNews,13,25,truth,"Your source for original reporting and trusted news.

📺 CBS | Streaming on the CBS News app | @ParamountPlus"
"Harvey Weinstein is facing another trial over rape and sexual assault charges – this time in L.A., police are investigating a shooting outside NY Rep. Lee Zeldin's home, and runner Emily Sisson sets new American record at the Chicago Marathon. Here's what's coming up on CBS News. ","New York, NY",597,8808966,CBSNews,8,26,truth,"Your source for original reporting and trusted news.

📺 CBS | Streaming on the CBS News app | @ParamountPlus"
"14-year-old Chloe Campbell has been missing since Sept. 30, when her parents say eyewitnesses saw her with two ""older men"" who were ""too old to be in high school."" ","New York, NY",597,8808966,CBSNews,36,40,truth,"Your source for original reporting and trusted news.

📺 CBS | Streaming on the CBS News app | @ParamountPlus"
"A result is imminent in Brazil's crucial presidential election - follow updates from @katywatson @vanessabusch @LauraTrevelyan and others here:
",USA,998,1066,glevns,4,3,truth,News editor @BBCNorthAmerica / gareth.lewis.evans@bbc.co.uk 🏴󠁧󠁢󠁷󠁬󠁳󠁿
"RT @BernieDebusmann: In Florida, we've been hearing some harrowing tales of #HurricanIan and lots of uncertainty about what the future migh…",USA,998,1066,glevns,6,0,truth,News editor @BBCNorthAmerica / gareth.lewis.evans@bbc.co.uk 🏴󠁧󠁢󠁷󠁬󠁳󠁿
"RT @BBCBreaking: Queen Elizabeth II, the UK’s monarch for the past 70 years, has died aged 96 ",USA,998,1066,glevns,221911,0,truth,News editor @BBCNorthAmerica / gareth.lewis.evans@bbc.co.uk 🏴󠁧󠁢󠁷󠁬󠁳󠁿
"RT @BBCBreaking: Myles Sanderson, the Canadian mass stabbing suspect, has been arrested - ending manhunt that took in three provinces https…",USA,998,1066,glevns,323,0,truth,News editor @BBCNorthAmerica / gareth.lewis.evans@bbc.co.uk 🏴󠁧󠁢󠁷󠁬󠁳󠁿
"RT @hollyhonderich: As Serena Williams prepares for her final appearance at the US Open, a look back at the moment that launched her matchl…",USA,998,1066,glevns,6,0,truth,News editor @BBCNorthAmerica / gareth.lewis.evans@bbc.co.uk 🏴󠁧󠁢󠁷󠁬󠁳󠁿
"RT @BernieDebusmann: For years, Radio Mambi in #Miami has been a fixture of the city's airwaves. But now, a surprise sale has sparked contr…",USA,998,1066,glevns,7,0,truth,News editor @BBCNorthAmerica / gareth.lewis.evans@bbc.co.uk 🏴󠁧󠁢󠁷󠁬󠁳󠁿
"RT @joelmgunter: SAS operatives in Afghanistan repeatedly killed detainees and unarmed men in suspicious circumstances, according to a BBC…",USA,998,1066,glevns,106,0,truth,News editor @BBCNorthAmerica / gareth.lewis.evans@bbc.co.uk 🏴󠁧󠁢󠁷󠁬󠁳󠁿
@AlixKroeger @BBCNorthAmerica Thanks Alix!,USA,998,1066,glevns,0,0,truth,News editor @BBCNorthAmerica / gareth.lewis.evans@bbc.co.uk 🏴󠁧󠁢󠁷󠁬󠁳󠁿
Excited to start as a news editor with the brilliant ⁦⁦⁦⁦@BBCNorthAmerica⁩ team. I’ll be in Washington until the end of the year. Boldly predicting that it could be busy… ,USA,998,1066,glevns,0,11,truth,News editor @BBCNorthAmerica / gareth.lewis.evans@bbc.co.uk 🏴󠁧󠁢󠁷󠁬󠁳󠁿
"RT @hugobachega: Civilians leaving Russian-occupied Mariupol are forced to go through filtration. It's humiliating for most, brutal for som…",USA,998,1066,glevns,75,0,truth,News editor @BBCNorthAmerica / gareth.lewis.evans@bbc.co.uk 🏴󠁧󠁢󠁷󠁬󠁳󠁿
"RT @mrjohnofarrell: This obituary in today's @guardian is an incredible story. That's one hell of an epiphany in the middle of his life.
ht…",USA,998,1066,glevns,1005,0,truth,News editor @BBCNorthAmerica / gareth.lewis.evans@bbc.co.uk 🏴󠁧󠁢󠁷󠁬󠁳󠁿
RT @Cymru: CWPAN Y BYD!!!! ,USA,998,1066,glevns,3486,0,truth,News editor @BBCNorthAmerica / gareth.lewis.evans@bbc.co.uk 🏴󠁧󠁢󠁷󠁬󠁳󠁿
RT @tessa_wong: If you only had to read one Jubilee piece it's this excellent deep dive into the Queen and her Corgis by @BexSeales . Featu…,USA,998,1066,glevns,6,0,truth,News editor @BBCNorthAmerica / gareth.lewis.evans@bbc.co.uk 🏴󠁧󠁢󠁷󠁬󠁳󠁿
"RT @joelmgunter: After the discovery of the atrocities in Bucha came the job of collecting of the dead. 

It is being done, with extraordin…",USA,998,1066,glevns,72,0,truth,News editor @BBCNorthAmerica / gareth.lewis.evans@bbc.co.uk 🏴󠁧󠁢󠁷󠁬󠁳󠁿
"RT @hugobachega: A week ago, a theatre in the besieged city of Mariupol where hundreds of civilians were sheltering was attacked. Ukraine a…",USA,998,1066,glevns,341,0,truth,News editor @BBCNorthAmerica / gareth.lewis.evans@bbc.co.uk 🏴󠁧󠁢󠁷󠁬󠁳󠁿
RT @sissydissy: We are hiring journalists for the @BBCNews Digital News team. We want excellent writers with creative ideas for covering th…,USA,998,1066,glevns,278,0,truth,News editor @BBCNorthAmerica / gareth.lewis.evans@bbc.co.uk 🏴󠁧󠁢󠁷󠁬󠁳󠁿
"'I didn't know whether I would meet Russian forces. When I will return to my home, and whether it will be standing, it is impossible to know.' 

Another moving piece from Marta Shokalo, who left Kyiv with her son this morning.
",USA,998,1066,glevns,1,5,truth,News editor @BBCNorthAmerica / gareth.lewis.evans@bbc.co.uk 🏴󠁧󠁢󠁷󠁬󠁳󠁿
"RT @PonniahKevin: As Russian forces enter Kyiv, follow live updates from @BBCNews here. This is a huge collaborative effort running 24/7 an…",USA,998,1066,glevns,5,0,truth,News editor @BBCNorthAmerica / gareth.lewis.evans@bbc.co.uk 🏴󠁧󠁢󠁷󠁬󠁳󠁿
RT @joelmgunter: Stigma over mental health and a lack of clarity around the statistics are clouding the toll of suicide on Ukraine’s milita…,USA,998,1066,glevns,11,0,truth,News editor @BBCNorthAmerica / gareth.lewis.evans@bbc.co.uk 🏴󠁧󠁢󠁷󠁬󠁳󠁿
@maxrushden @guardian_sport @Towno10 @JohnBrewin_ @bglendenning After the two teams least interested in playing football finally took to the field for a 0-0 draw - what's the longest you've avoided doing something you're terrible at?,USA,998,1066,glevns,0,5,truth,News editor @BBCNorthAmerica / gareth.lewis.evans@bbc.co.uk 🏴󠁧󠁢󠁷󠁬󠁳󠁿
RT @BBCSteveR: Trying to press Alexander Lukashenko on human rights in Belarus. You can watch a 24-min version of our interview today on @B…,USA,998,1066,glevns,3285,0,truth,News editor @BBCNorthAmerica / gareth.lewis.evans@bbc.co.uk 🏴󠁧󠁢󠁷󠁬󠁳󠁿
RT @GeorginaRannard: Dozens of English language trainers for the British Council in Afghanistan told me they’re being denied UK visas becau…,USA,998,1066,glevns,3,0,truth,News editor @BBCNorthAmerica / gareth.lewis.evans@bbc.co.uk 🏴󠁧󠁢󠁷󠁬󠁳󠁿
RT @BBCWorld: 'They will kill me': Desperate Afghans seek way out after Taliban takeover ,USA,998,1066,glevns,291,0,truth,News editor @BBCNorthAmerica / gareth.lewis.evans@bbc.co.uk 🏴󠁧󠁢󠁷󠁬󠁳󠁿
"One of the great things about this Euros has been the Official Wales Fans Spokesman @elisjames channeling exactly what we're feeling at each stage. I am, however, already extremely tense  ",USA,998,1066,glevns,0,2,truth,News editor @BBCNorthAmerica / gareth.lewis.evans@bbc.co.uk 🏴󠁧󠁢󠁷󠁬󠁳󠁿
RT @hugobachega: Thousands of illegal miners have invaded the Brazilian Amazon under President Bolsonaro. Deforestation and violence agains…,USA,998,1066,glevns,5,0,truth,News editor @BBCNorthAmerica / gareth.lewis.evans@bbc.co.uk 🏴󠁧󠁢󠁷󠁬󠁳󠁿
"RT @kl_coop: Every year an unknown number of American children are sent away into programmes meant to fix them. 

The Troubled Teen Industr…",USA,998,1066,glevns,58,0,truth,News editor @BBCNorthAmerica / gareth.lewis.evans@bbc.co.uk 🏴󠁧󠁢󠁷󠁬󠁳󠁿
RT @elisjames: Turkey 0 Wales 2. If only I could bottle this feeling. It’s heaven,USA,998,1066,glevns,227,0,truth,News editor @BBCNorthAmerica / gareth.lewis.evans@bbc.co.uk 🏴󠁧󠁢󠁷󠁬󠁳󠁿
RT @C4Ciaran: 🏴󠁧󠁢󠁷󠁬󠁳󠁿🏴󠁧󠁢󠁷󠁬󠁳󠁿🏴󠁧󠁢󠁷󠁬󠁳󠁿🏴󠁧󠁢󠁷󠁬󠁳󠁿🏴󠁧󠁢󠁷󠁬󠁳󠁿🏴󠁧󠁢󠁷󠁬󠁳󠁿🏴󠁧󠁢󠁷󠁬󠁳󠁿🏴󠁧󠁢󠁷󠁬󠁳󠁿🏴󠁧󠁢󠁷󠁬󠁳󠁿🏴󠁧󠁢󠁷󠁬󠁳󠁿🏴󠁧󠁢󠁷󠁬󠁳󠁿🏴󠁧󠁢󠁷󠁬󠁳󠁿🏴󠁧󠁢󠁷󠁬󠁳󠁿🏴󠁧󠁢󠁷󠁬󠁳󠁿🏴󠁧󠁢󠁷󠁬󠁳󠁿🏴󠁧󠁢󠁷󠁬󠁳󠁿C’mon 🏴󠁧󠁢󠁷󠁬󠁳󠁿…,USA,998,1066,glevns,278,0,truth,News editor @BBCNorthAmerica / gareth.lewis.evans@bbc.co.uk 🏴󠁧󠁢󠁷󠁬󠁳󠁿
@vickybaker Thanks Vicky!,USA,998,1066,glevns,0,1,truth,News editor @BBCNorthAmerica / gareth.lewis.evans@bbc.co.uk 🏴󠁧󠁢󠁷󠁬󠁳󠁿
"Crump has represented the families of George Floyd, Breonna Taylor, Daunte Wright and dozens more in their civil suits. Those I spoke to suggested he was always given the call due to a mixture of momentum, proven results, and media-savviness.",USA,998,1066,glevns,1,0,truth,News editor @BBCNorthAmerica / gareth.lewis.evans@bbc.co.uk 🏴󠁧󠁢󠁷󠁬󠁳󠁿
"Ben Crump is seemingly involved in every high-profile police shooting case in America. I wondered why it was always him, and spoke to his friends and the families he's worked with to try and find out:
",USA,998,1066,glevns,3,5,truth,News editor @BBCNorthAmerica / gareth.lewis.evans@bbc.co.uk 🏴󠁧󠁢󠁷󠁬󠁳󠁿
"RT @BBCBreaking: Judge Peter Cahill reads guilty verdict in trial of Derek Chauvin, the former policeman who has been convicted of murderin…",USA,998,1066,glevns,3971,0,truth,News editor @BBCNorthAmerica / gareth.lewis.evans@bbc.co.uk 🏴󠁧󠁢󠁷󠁬󠁳󠁿
"RT @BBCBreaking: Jury reaches verdict in murder trial of Derek Chauvin over death of George Floyd in May 2020

Follow our live coverage ahe…",USA,998,1066,glevns,469,0,truth,News editor @BBCNorthAmerica / gareth.lewis.evans@bbc.co.uk 🏴󠁧󠁢󠁷󠁬󠁳󠁿
RT @BBCLBicker: 'The grim reality of reporting in China that pushed me out’ by ⁦@TheJohnSudworth⁩  ,USA,998,1066,glevns,50,0,truth,News editor @BBCNorthAmerica / gareth.lewis.evans@bbc.co.uk 🏴󠁧󠁢󠁷󠁬󠁳󠁿
"RT @BBCSport: WALES ARE #SIXNATIONS CHAMPIONS! 👑

Scotland seal victory right at the end!

FT

France 23-27 Scotland

#FRAvSCO #bbcrugby",USA,998,1066,glevns,519,0,truth,News editor @BBCNorthAmerica / gareth.lewis.evans@bbc.co.uk 🏴󠁧󠁢󠁷󠁬󠁳󠁿
"Oliver, 6: “I would just push the back until it was free. I’ve seen things like this in my life.""

Harper, 13: “They should get everyone in Egypt, and everyone brings their own rope... and everyone pulls it.""

'Ask kids' is the best story treatment imo

",USA,998,1066,glevns,0,5,truth,News editor @BBCNorthAmerica / gareth.lewis.evans@bbc.co.uk 🏴󠁧󠁢󠁷󠁬󠁳󠁿
"@Gerryholt @BBCWorld @hughesroland Diolch Gerry! It's actually curry night in W1A, so slightly less depressing I suppose...",USA,998,1066,glevns,0,1,truth,News editor @BBCNorthAmerica / gareth.lewis.evans@bbc.co.uk 🏴󠁧󠁢󠁷󠁬󠁳󠁿
@kl_coop @daniellehayd Love him. You just don't get this from your Peps and your Joses,USA,998,1066,glevns,0,2,truth,News editor @BBCNorthAmerica / gareth.lewis.evans@bbc.co.uk 🏴󠁧󠁢󠁷󠁬󠁳󠁿
RT @atmccann: been thinking a lot about vaccine inequality lately — this piece is the result of working with NYT reporters across more than…,USA,998,1066,glevns,618,0,truth,News editor @BBCNorthAmerica / gareth.lewis.evans@bbc.co.uk 🏴󠁧󠁢󠁷󠁬󠁳󠁿
"RT @sfchronicle: Lawrence Ferlinghetti, San Francisco poet and co-founder of City Lights, has died. 

Here's an interview with Ferlinghetti…",USA,998,1066,glevns,37,0,truth,News editor @BBCNorthAmerica / gareth.lewis.evans@bbc.co.uk 🏴󠁧󠁢󠁷󠁬󠁳󠁿
RT @paulkirbyuk: After a year of Covid in Europe my BBC colleagues and others have considered what has changed in this time of pandemic - @…,USA,998,1066,glevns,10,0,truth,News editor @BBCNorthAmerica / gareth.lewis.evans@bbc.co.uk 🏴󠁧󠁢󠁷󠁬󠁳󠁿
@vickybaker This was really brilliant. Loved it!,USA,998,1066,glevns,0,5,truth,News editor @BBCNorthAmerica / gareth.lewis.evans@bbc.co.uk 🏴󠁧󠁢󠁷󠁬󠁳󠁿
"RT @vickybaker: Jim Haynes opened his Paris home to anyone who wanted to come to dinner. Every Sunday for 40-plus yrs, until he was 87. And…",USA,998,1066,glevns,72,0,truth,News editor @BBCNorthAmerica / gareth.lewis.evans@bbc.co.uk 🏴󠁧󠁢󠁷󠁬󠁳󠁿
"RT @BBCBreaking: ""Congratulations Mr President""

Joe Biden sworn in by Supreme Court Chief Justice John Roberts, becoming the 46th presiden…",USA,998,1066,glevns,1082,0,truth,News editor @BBCNorthAmerica / gareth.lewis.evans@bbc.co.uk 🏴󠁧󠁢󠁷󠁬󠁳󠁿
"RT @vickybaker: Unusual for the BBC News website and app to lead with a video. Figured it had to be strong, but this is something else. A d…",USA,998,1066,glevns,52,0,truth,News editor @BBCNorthAmerica / gareth.lewis.evans@bbc.co.uk 🏴󠁧󠁢󠁷󠁬󠁳󠁿
RT @BBCSteveR: The moment Alexei Navalny was detained at passport control in Moscow's Sheremetevo Airport. Camera @LizaVereykina Producer @…,USA,998,1066,glevns,630,0,truth,News editor @BBCNorthAmerica / gareth.lewis.evans@bbc.co.uk 🏴󠁧󠁢󠁷󠁬󠁳󠁿
"A few months ago @drjuliashaw and @SofieHagen devoted an episode of their podcast to a story I wrote, and used my (low quality) recordings and various other stuff. They're v good - you can listen here: ",USA,998,1066,glevns,1,8,truth,News editor @BBCNorthAmerica / gareth.lewis.evans@bbc.co.uk 🏴󠁧󠁢󠁷󠁬󠁳󠁿
"RT @BBCBreaking: US Capitol on lockdown as Trump demonstrators swarm the building during Biden certification debate

Latest: ",USA,998,1066,glevns,3713,0,truth,News editor @BBCNorthAmerica / gareth.lewis.evans@bbc.co.uk 🏴󠁧󠁢󠁷󠁬󠁳󠁿
RT @PatriciaMazzei: Every paragraph of this piece by Jeff Leen on John le Carré’s Miami swing to do research for “The Night Manager” is del…,USA,998,1066,glevns,69,0,truth,News editor @BBCNorthAmerica / gareth.lewis.evans@bbc.co.uk 🏴󠁧󠁢󠁷󠁬󠁳󠁿
"A combined effort from @maddysavage, @Hedgecoe, @BethanyBellBB, Dany Mitzman and others",USA,998,1066,glevns,0,1,truth,News editor @BBCNorthAmerica / gareth.lewis.evans@bbc.co.uk 🏴󠁧󠁢󠁷󠁬󠁳󠁿
"Atletico Madrid striker Antoine Griezmann made his loan from Barcelona permanent on Monday by signing a contract to stay in the Spanish capital until 2026.
#AFPSports

",France,606,2412700,AFP,6,13,truth,Top news and features from AFP's reporters around the world. Elsewhere on Twitter: https://t.co/ELSlBpSrHN
"Residents of Las Tejerias on Monday used picks, shovels and any tools they could find to dig through a thick bank of mud deposited on the northern Venezuelan town after a landslide over the weekend killed at least 25 people and left 52 missing.

 ",France,606,2412700,AFP,14,18,truth,Top news and features from AFP's reporters around the world. Elsewhere on Twitter: https://t.co/ELSlBpSrHN
"China recorded more than 2,000 Covid cases on Monday, its highest level for a month, as officials imposed new lockdowns and restrictions to stop outbreaks from spreading to the capital ahead of the Communist Party Congress.

Full story:  ",France,606,2412700,AFP,20,29,truth,Top news and features from AFP's reporters around the world. Elsewhere on Twitter: https://t.co/ELSlBpSrHN
"American Dustin Johnson has pocketed $18 million after securing the inaugural LIV Golf individual championship, organisers of the Saudi-backed breakaway tour announced Monday.

Read more from #AFPSports:  ",France,606,2412700,AFP,1,10,truth,Top news and features from AFP's reporters around the world. Elsewhere on Twitter: https://t.co/ELSlBpSrHN
#BREAKING EU declares Nicaragua envoy persona non grata: statement ,France,606,2412700,AFP,34,52,truth,Top news and features from AFP's reporters around the world. Elsewhere on Twitter: https://t.co/ELSlBpSrHN
"Chad's ruler said Monday a national unity government would be created soon to steer the country toward eventual civilian rule, with him as interim president.

Mahamat Idriss Deby Itno came to power last year after his long-ruling father died in combat.

",France,606,2412700,AFP,9,16,truth,Top news and features from AFP's reporters around the world. Elsewhere on Twitter: https://t.co/ELSlBpSrHN
"Kyiv residents describe to AFP's @EmmanuelP_AFP
being shaken awake by Russia's missile strikes Monday morning.

""We saw the smoke, then the cars and then we realised we had no more windows,""  says one Ukrainian woman.

",France,606,2412700,AFP,13,48,truth,Top news and features from AFP's reporters around the world. Elsewhere on Twitter: https://t.co/ELSlBpSrHN
"Air France and Airbus were put on trial Monday on charges of involuntary manslaughter over the 2009 crash of a jet heading to Paris from Brazil, in which all 228 people on board were killed.

Full story:  ",France,606,2412700,AFP,12,18,truth,Top news and features from AFP's reporters around the world. Elsewhere on Twitter: https://t.co/ELSlBpSrHN
#BREAKING Biden condemns 'utter brutality' of Russian missile strikes on Ukraine ,France,606,2412700,AFP,74,294,truth,Top news and features from AFP's reporters around the world. Elsewhere on Twitter: https://t.co/ELSlBpSrHN
"For generations Paban Baroi's family guarded a temple to Shiva, the Hindu god of destruction, until Bangladesh's mighty Padma river wreaked havoc of its own, wiping out the shrine, their home, and 200 other houses in their village.
",France,606,2412700,AFP,10,21,truth,Top news and features from AFP's reporters around the world. Elsewhere on Twitter: https://t.co/ELSlBpSrHN
"#UPDATE RedBull and Aston Martin have been found in breach of F1 financial rules, the motor sports governing body (FIA) announced on Monday, saying any punishment would be decided at a later date. ",France,606,2412700,AFP,17,43,truth,Top news and features from AFP's reporters around the world. Elsewhere on Twitter: https://t.co/ELSlBpSrHN
#BREAKING Red Bull found guilty of breaching F1 cost cap: the FIA ,France,606,2412700,AFP,55,175,truth,Top news and features from AFP's reporters around the world. Elsewhere on Twitter: https://t.co/ELSlBpSrHN
"An international footballer, an influential tech-blogger, a woman eating her breakfast without a headscarf. 
In Iran, no-one who expresses dissent is safe from being caught in the dragnet of a crackdown that has seen hundreds arrested in the last 3 weeks. 
",France,606,2412700,AFP,10,31,truth,Top news and features from AFP's reporters around the world. Elsewhere on Twitter: https://t.co/ELSlBpSrHN
"Russian forces launch a barrage of fatal bombardments across Ukraine as President Vladimir Putin threatens more attacks and the West lashes out at Moscow's ""act of desperation"".
",France,606,2412700,AFP,19,46,truth,Top news and features from AFP's reporters around the world. Elsewhere on Twitter: https://t.co/ELSlBpSrHN
"Germany's cyber security agency chief is facing the sack over alleged ties with Russian intelligence services, government sources told AFP on Monday, amid heightened vigilance over potential sabotage activities by Moscow.
",France,606,2412700,AFP,54,133,truth,Top news and features from AFP's reporters around the world. Elsewhere on Twitter: https://t.co/ELSlBpSrHN
"#UPDATE UN chief Antonio Guterres on Monday condemned Russia for launching a barrage of fatal bombardments across #Ukraine 
 
""This constitutes another unacceptable escalation of the war and, as always, civilians are paying the highest price,"" his spokesman said. ",France,606,2412700,AFP,45,99,truth,Top news and features from AFP's reporters around the world. Elsewhere on Twitter: https://t.co/ELSlBpSrHN
"VIDEO: Around a thousand people formed a human chain around the UK parliament in London on Saturday, demanding the release of WikiLeaks founder Julian Assange. ",France,606,2412700,AFP,121,306,truth,Top news and features from AFP's reporters around the world. Elsewhere on Twitter: https://t.co/ELSlBpSrHN
#BREAKING UN chief slams Russia strikes on Ukraine as 'unacceptable escalation' ,France,606,2412700,AFP,98,294,truth,Top news and features from AFP's reporters around the world. Elsewhere on Twitter: https://t.co/ELSlBpSrHN
"Five decades ago, a lawyer convinced a French court to acquit a teenage girl who illegally terminated her pregnancy after being raped, a landmark case that would pave the way for the right to abortion in France.
",France,606,2412700,AFP,20,48,truth,Top news and features from AFP's reporters around the world. Elsewhere on Twitter: https://t.co/ELSlBpSrHN
"#UPDATE The ""deliberate strikes by Russia over the whole of Ukraine's territory and against civilians, it's a profound change in the nature of this war,"" French President Emmanuel Macron told reporters today. ",France,606,2412700,AFP,166,435,truth,Top news and features from AFP's reporters around the world. Elsewhere on Twitter: https://t.co/ELSlBpSrHN
