text,location,friends_count,followers_count,screen_name,retweet_count,favorite_count,label,description
Igor Tikhiy is one of thousands of Russian men who have left their country since President Vladimir Putin announced a nationwide mobilisation drive in a bid to recruit new manpower for Moscow's war on Ukraine. ,New York City,2336,1097327,YahooNews,2,4,truth,Top stories. Trusted sources. Your window to the news that matters most to you. Current live events pinned below. Download our app here: https://t.co/aOTqWBhwuB
"A small business advocacy group has filed a new lawsuit seeking to block the Biden administration’s efforts to forgive student loan debt for tens of millions of Americans.
",New York City,2336,1097327,YahooNews,4,3,truth,Top stories. Trusted sources. Your window to the news that matters most to you. Current live events pinned below. Download our app here: https://t.co/aOTqWBhwuB
"Some of the nation's largest airports have been targeted for cyberattacks by an attacker within the Russian Federation. The systems targeted do not handle air traffic control, internal airline communications and coordination, or transportation security.
",New York City,2336,1097327,YahooNews,1,2,truth,Top stories. Trusted sources. Your window to the news that matters most to you. Current live events pinned below. Download our app here: https://t.co/aOTqWBhwuB
"Ukraine’s National Police said 8 people were killed in Kyiv, with 24 more injured, although the final toll for fatalities and casualties is likely to be much higher. 
",New York City,2336,1097327,YahooNews,2,3,truth,Top stories. Trusted sources. Your window to the news that matters most to you. Current live events pinned below. Download our app here: https://t.co/aOTqWBhwuB
"“After seeing their grief, I thought it would be better if we can hold the ceremony at the same time and that all relatives can go through this final stage of this painful event together."" ",New York City,2336,1097327,YahooNews,0,5,truth,Top stories. Trusted sources. Your window to the news that matters most to you. Current live events pinned below. Download our app here: https://t.co/aOTqWBhwuB
"A 52-year-old Ukrainian woman named Alla said she was subject to physical and sexual abuse at the hands of Russian troops during their occupation of Izium, providing yet another firsthand account of alleged war crimes. ",New York City,2336,1097327,YahooNews,1,3,truth,Top stories. Trusted sources. Your window to the news that matters most to you. Current live events pinned below. Download our app here: https://t.co/aOTqWBhwuB
Two young children are dead and their mother suffered major injuries after two family dogs attacked a baby and toddler at their West Tennessee home. ,New York City,2336,1097327,YahooNews,2,1,truth,Top stories. Trusted sources. Your window to the news that matters most to you. Current live events pinned below. Download our app here: https://t.co/aOTqWBhwuB
"A video shared by ABC 24 Memphis showed what appeared to be a Chick-fil-A employee spitting in chicken batter, while the other recorded. ",New York City,2336,1097327,YahooNews,10,8,truth,Top stories. Trusted sources. Your window to the news that matters most to you. Current live events pinned below. Download our app here: https://t.co/aOTqWBhwuB
"While forced labor still exists throughout the world, one place where it’s especially pervasive is the South China Sea — especially in the Thai fishing fleet, according to a 2016 investigation by the NYT... (@ian_urbina) Listen:  ",New York City,2336,1097327,YahooNews,9,6,truth,Top stories. Trusted sources. Your window to the news that matters most to you. Current live events pinned below. Download our app here: https://t.co/aOTqWBhwuB
"“I’m on Herschel’s team — they picked the wrong Georgian to mess with,"" Republican Sen. Rick Scott of Florida said. ",New York City,2336,1097327,YahooNews,0,4,truth,Top stories. Trusted sources. Your window to the news that matters most to you. Current live events pinned below. Download our app here: https://t.co/aOTqWBhwuB
"“Did you know Herschel paid for my abortion the first time? Or that he told me it wasn’t the ‘right time’ to have [her current child]?” the woman wrote in a text message sent to Herschel Walker’s wife, Julie Walker, who initiated the conversation. ",New York City,2336,1097327,YahooNews,3,4,truth,Top stories. Trusted sources. Your window to the news that matters most to you. Current live events pinned below. Download our app here: https://t.co/aOTqWBhwuB
"""He's only interested in one thing: the get out of jail free card,"" Michael Cohen said. ""And that's exactly what he saw in those documents."" ",New York City,2336,1097327,YahooNews,8,15,truth,Top stories. Trusted sources. Your window to the news that matters most to you. Current live events pinned below. Download our app here: https://t.co/aOTqWBhwuB
"A Mississippi woman who said she was fired for wearing a ""Scream"" mask to scare children at the daycare where she worked, later shared a tearful apology online. ",New York City,2336,1097327,YahooNews,2,6,truth,Top stories. Trusted sources. Your window to the news that matters most to you. Current live events pinned below. Download our app here: https://t.co/aOTqWBhwuB
"Aides to Trump did not pitch his proposal to the National Archives, knowing it would be rejected. ",New York City,2336,1097327,YahooNews,2,6,truth,Top stories. Trusted sources. Your window to the news that matters most to you. Current live events pinned below. Download our app here: https://t.co/aOTqWBhwuB
"U.S. District Judge Randolph Moss is scheduled to sentence Alan Byerly on Oct. 21 for his attack on AP photographer John Minchillo and police during the Jan. 6, 2021, riot in Washington. ",New York City,2336,1097327,YahooNews,6,7,truth,Top stories. Trusted sources. Your window to the news that matters most to you. Current live events pinned below. Download our app here: https://t.co/aOTqWBhwuB
"Stanford University is investigating after a woman reported having been raped in the basement of a campus building Friday, the school announced Saturday, marking the second report of a rape on the elite Northern California campus in as many months. ",New York City,2336,1097327,YahooNews,2,4,truth,Top stories. Trusted sources. Your window to the news that matters most to you. Current live events pinned below. Download our app here: https://t.co/aOTqWBhwuB
"Trump's speech also falsely claimed that Obama moved over 33 million pages of documents to a ""totally unsafe former furniture store."" ",New York City,2336,1097327,YahooNews,2,11,truth,Top stories. Trusted sources. Your window to the news that matters most to you. Current live events pinned below. Download our app here: https://t.co/aOTqWBhwuB
"According to The NYT, Trump often eschewed reading through detailed intelligence reports but was attracted to graphics and other data-driven visuals. ",New York City,2336,1097327,YahooNews,3,3,truth,Top stories. Trusted sources. Your window to the news that matters most to you. Current live events pinned below. Download our app here: https://t.co/aOTqWBhwuB
A group called Cooperative Last Will asked the court to declare that the Dutch state is “acting unlawfully by denying its citizens the right to die with dignity under their own control.” ,New York City,2336,1097327,YahooNews,3,0,truth,Top stories. Trusted sources. Your window to the news that matters most to you. Current live events pinned below. Download our app here: https://t.co/aOTqWBhwuB
"Putin, whose forces invaded neighboring Ukraine on Feb. 24, said the strikes were retaliation for what he called Kyiv's “terrorist” actions — a reference to Ukraine's attempts to repel Moscow's invasion force and cripple their supply lines. ",New York City,2336,1097327,YahooNews,0,2,truth,Top stories. Trusted sources. Your window to the news that matters most to you. Current live events pinned below. Download our app here: https://t.co/aOTqWBhwuB
"According to the American Kennel Club, the lifetime cost for small dogs, which have an average life expectancy of 15 years, is approximately $15,051, while large dogs, which have an average life expectancy of 10 years, have a lifetime cost of $14,480. ",New York City,2336,1097327,YahooNews,1,5,truth,Top stories. Trusted sources. Your window to the news that matters most to you. Current live events pinned below. Download our app here: https://t.co/aOTqWBhwuB
North Korea’s recent barrage of missile launches were the simulated use of its tactical battlefield nuclear weapons to “hit and wipe out” potential South Korean and U.S. targets. ,New York City,2336,1097327,YahooNews,2,2,truth,Top stories. Trusted sources. Your window to the news that matters most to you. Current live events pinned below. Download our app here: https://t.co/aOTqWBhwuB
"RT @Isikoff: In light of ruling by Obama-appointed judge rejecting @fairfightaction lawsuit ""on all counts,"" @Dahlialithwick of @Slate, a l…",New York City,2336,1097327,YahooNews,14,0,truth,Top stories. Trusted sources. Your window to the news that matters most to you. Current live events pinned below. Download our app here: https://t.co/aOTqWBhwuB
A boy ran onto the field and was tackled hard by a security guard in the second quarter of Tampa Bay’s game against Atlanta. ,New York City,2336,1097327,YahooNews,1,4,truth,Top stories. Trusted sources. Your window to the news that matters most to you. Current live events pinned below. Download our app here: https://t.co/aOTqWBhwuB
"Former Secretary of State Mike Pompeo says President Biden was ""reckless"" in warning last week about the possible use of nuclear weapons by President Vladimir Putin and Russia. ",New York City,2336,1097327,YahooNews,3,6,truth,Top stories. Trusted sources. Your window to the news that matters most to you. Current live events pinned below. Download our app here: https://t.co/aOTqWBhwuB
"Some Democrats in tough re-election campaigns have tried to inoculate themselves on crime ahead of the midterm elections, hoping to counter brutal Republican ads on the issue.  ",New York City,2336,1097327,YahooNews,0,3,truth,Top stories. Trusted sources. Your window to the news that matters most to you. Current live events pinned below. Download our app here: https://t.co/aOTqWBhwuB
"RT @michaeldweiss: NEW: I sat down earlier this week in Tallinn with @MarrMikk, the outgoing director of Välisluureamet, Estonia's foreign…",New York City,2336,1097327,YahooNews,579,0,truth,Top stories. Trusted sources. Your window to the news that matters most to you. Current live events pinned below. Download our app here: https://t.co/aOTqWBhwuB
RT @SkullduggeryPod: WATCH: @isikoff @Dahlialithwick exchange about #StaceyAbrams big defeat in court ,New York City,2336,1097327,YahooNews,4,0,truth,Top stories. Trusted sources. Your window to the news that matters most to you. Current live events pinned below. Download our app here: https://t.co/aOTqWBhwuB
"Since the new Cold War turned hot in February, Estonia’s Prime Minister Kaja Kallas has been an outspoken champion of Ukraine’s military victory. ",New York City,2336,1097327,YahooNews,0,7,truth,Top stories. Trusted sources. Your window to the news that matters most to you. Current live events pinned below. Download our app here: https://t.co/aOTqWBhwuB
Kremlin leader Vladimir Putin says that the explosion on a key bridge linking Crimea and the Russian mainland was a terrorist act planned by the Ukrainian special services. ,New York City,2336,1097327,YahooNews,5,10,truth,Top stories. Trusted sources. Your window to the news that matters most to you. Current live events pinned below. Download our app here: https://t.co/aOTqWBhwuB
"Russia launched multiple missile attacks into the Ukrainian city of Zaporizhzhia overnight, killing at least 17 people and wounding dozens in an apparent reprisal for a blast that damaged a Crimean bridge. ",New York City,2336,1097327,YahooNews,6,5,truth,Top stories. Trusted sources. Your window to the news that matters most to you. Current live events pinned below. Download our app here: https://t.co/aOTqWBhwuB
The Israel's Defense Ministry has reached a settlement to compensate the family of a Palestinian-American man who died earlier this year after he was detained by Israeli troops in the occupied West Bank. ,New York City,2336,1097327,YahooNews,2,5,truth,Top stories. Trusted sources. Your window to the news that matters most to you. Current live events pinned below. Download our app here: https://t.co/aOTqWBhwuB
"Fans are raving about the Disney+ series “Ms. Marvel”, the series is about a superhero-obsessed Pakistani American teenager and shines a spotlight on South Asian heritage. ",New York City,2336,1097327,YahooNews,0,3,truth,Top stories. Trusted sources. Your window to the news that matters most to you. Current live events pinned below. Download our app here: https://t.co/aOTqWBhwuB
"By pardoning Americans with federal convictions for marijuana possession, President Joe Biden said he aimed to partially redress decades of anti-drug laws that disproportionately harmed Black and Latino communities. ",New York City,2336,1097327,YahooNews,1,6,truth,Top stories. Trusted sources. Your window to the news that matters most to you. Current live events pinned below. Download our app here: https://t.co/aOTqWBhwuB
"North Korea fired two short-range ballistic missiles toward its eastern waters, the latest in its barrage of weapons tests in recent days, after the North warned against the U.S. redeployment of an aircraft carrier. ",New York City,2336,1097327,YahooNews,2,1,truth,Top stories. Trusted sources. Your window to the news that matters most to you. Current live events pinned below. Download our app here: https://t.co/aOTqWBhwuB
NASCAR says it had a productive test of its new car and promised drivers that solutions to some of their safety concerns should be implemented by next season. ,New York City,2336,1097327,YahooNews,2,4,truth,Top stories. Trusted sources. Your window to the news that matters most to you. Current live events pinned below. Download our app here: https://t.co/aOTqWBhwuB
Residents were allowed to return to a coastal island that was decimated by Hurricane Ian with a warning from the governor that the disaster isn't over. ,New York City,2336,1097327,YahooNews,1,4,truth,Top stories. Trusted sources. Your window to the news that matters most to you. Current live events pinned below. Download our app here: https://t.co/aOTqWBhwuB
"An Ohio judge indefinitely blocked a state law that prohibited most abortions after six weeks of pregnancy, according to The Cincinnati Enquirer. Ohio Republican state Attorney General David Yost is expected to appeal the decision. ",New York City,2336,1097327,YahooNews,10,32,truth,Top stories. Trusted sources. Your window to the news that matters most to you. Current live events pinned below. Download our app here: https://t.co/aOTqWBhwuB
"An Oregon serial rapist is set to be released from prison in mid-December after serving nearly 36 years behind bars, almost all of his maximum sentence. ",New York City,2336,1097327,YahooNews,7,7,truth,Top stories. Trusted sources. Your window to the news that matters most to you. Current live events pinned below. Download our app here: https://t.co/aOTqWBhwuB
"After three years of planning, five expeditions and a two-week trek through dense jungle, scientists have reached the tallest tree ever found in the Amazon rainforest, a towering specimen the size of a 25-storey building. ",New York City,2336,1097327,YahooNews,9,17,truth,Top stories. Trusted sources. Your window to the news that matters most to you. Current live events pinned below. Download our app here: https://t.co/aOTqWBhwuB
"Russian defense minister Sergei Shoigu would be ""happy"" to lose his job following a string of disastrous Russian defeats in Ukraine, according to The Guardian. ",New York City,2336,1097327,YahooNews,7,25,truth,Top stories. Trusted sources. Your window to the news that matters most to you. Current live events pinned below. Download our app here: https://t.co/aOTqWBhwuB
"A Navy veteran and father of two was laid to rest after his vehicle fell into a creek as he drove on a bridge that was in disrepair and should have been blocked off, according to North Carolina troopers. ",New York City,2336,1097327,YahooNews,4,9,truth,Top stories. Trusted sources. Your window to the news that matters most to you. Current live events pinned below. Download our app here: https://t.co/aOTqWBhwuB
"Florida officials began planning to transport migrants to other states in July and told potential contractors their task would be to relocate them on a voluntary basis, according to state documents. ",New York City,2336,1097327,YahooNews,3,4,truth,Top stories. Trusted sources. Your window to the news that matters most to you. Current live events pinned below. Download our app here: https://t.co/aOTqWBhwuB
"A Mississippi woman who said she was fired for wearing a ""Scream"" mask to scare children at the daycare where she worked, later shared a tearful apology online. ",New York City,2336,1097327,YahooNews,6,14,truth,Top stories. Trusted sources. Your window to the news that matters most to you. Current live events pinned below. Download our app here: https://t.co/aOTqWBhwuB
"Sen. Lindsey Graham reportedly told the mother of Brian Sicknick, the officer who died following the Jan 6 riot, that he would end a meeting with her if she kept talking bad about  Trump. ",New York City,2336,1097327,YahooNews,19,26,truth,Top stories. Trusted sources. Your window to the news that matters most to you. Current live events pinned below. Download our app here: https://t.co/aOTqWBhwuB
"Lindsey Graham offered advice about how officers should have responded during the deadly Jan. 6 Capitol attack, saying they should have shot the rioters in the head, according to a new book obtained by Politico. ",New York City,2336,1097327,YahooNews,5,13,truth,Top stories. Trusted sources. Your window to the news that matters most to you. Current live events pinned below. Download our app here: https://t.co/aOTqWBhwuB
I was hit by a car three years ago. It was a life-altering experience | Opinion ,"Dallas, Texas",785,771406,dallasnews,0,0,truth,The official Dallas Morning News Twitter account. Subscribe https://t.co/MqPw2ZUctn
Immigration will vex Biden no matter who controls Congress ,"Dallas, Texas",785,771406,dallasnews,0,4,truth,The official Dallas Morning News Twitter account. Subscribe https://t.co/MqPw2ZUctn
Exxon eyes takeover of Plano-based oil and gas company ,"Dallas, Texas",785,771406,dallasnews,2,1,truth,The official Dallas Morning News Twitter account. Subscribe https://t.co/MqPw2ZUctn
Dallas-Fort Worth skin care experts share their secrets for aging gracefully ,"Dallas, Texas",785,771406,dallasnews,0,0,truth,The official Dallas Morning News Twitter account. Subscribe https://t.co/MqPw2ZUctn
Two whistleblowing Richardson cops say they were frozen out of the department ,"Dallas, Texas",785,771406,dallasnews,1,2,truth,The official Dallas Morning News Twitter account. Subscribe https://t.co/MqPw2ZUctn
Dallas police chief elected president of Major Cities Chiefs Association ,"Dallas, Texas",785,771406,dallasnews,0,6,truth,The official Dallas Morning News Twitter account. Subscribe https://t.co/MqPw2ZUctn
Dallas International Film Festival trumpets a diverse lineup this year ,"Dallas, Texas",785,771406,dallasnews,0,0,truth,The official Dallas Morning News Twitter account. Subscribe https://t.co/MqPw2ZUctn
We recommend in the race for Texas House District 115 | Opinion ,"Dallas, Texas",785,771406,dallasnews,0,2,truth,The official Dallas Morning News Twitter account. Subscribe https://t.co/MqPw2ZUctn
Texas Pete hot sauce isn’t from the Lone Star State. A Californian has a problem with that ,"Dallas, Texas",785,771406,dallasnews,2,5,truth,The official Dallas Morning News Twitter account. Subscribe https://t.co/MqPw2ZUctn
Why do we pair a capable health care system with a nonsensical way of paying for it?  ,"Dallas, Texas",785,771406,dallasnews,2,2,truth,The official Dallas Morning News Twitter account. Subscribe https://t.co/MqPw2ZUctn
"Are you a Dallas County resident with diabetes?  What has your experience accessing diabetes care been like?

We want to talk to you for a story on health care accessibility in North Texas. DM @maringwolf or email her at marin.wolf@dallasnews.com to share your experience.","Dallas, Texas",785,771406,dallasnews,6,3,truth,The official Dallas Morning News Twitter account. Subscribe https://t.co/MqPw2ZUctn
Who are the Dallas attorneys for Oath Keeper founder Stewart Rhodes at his sedition trial? ,"Dallas, Texas",785,771406,dallasnews,1,0,truth,The official Dallas Morning News Twitter account. Subscribe https://t.co/MqPw2ZUctn
Better Block Foundation brings a new look to Garland ,"Dallas, Texas",785,771406,dallasnews,3,2,truth,The official Dallas Morning News Twitter account. Subscribe https://t.co/MqPw2ZUctn
Mayan speakers in Dallas face challenges while getting support from fellow Guatemalans ,"Dallas, Texas",785,771406,dallasnews,3,1,truth,The official Dallas Morning News Twitter account. Subscribe https://t.co/MqPw2ZUctn
"📺 Our @MitchellParton joins @NBCDFW in moments to discuss our Boomtowns series, including @Princeton_Texas, @cityofmelissatx, Royse City and @CityofForneyGov. Watch live, and check out the series.

👀 Watch: 
🏙️ Boomtowns:  ","Dallas, Texas",785,771406,dallasnews,2,0,truth,The official Dallas Morning News Twitter account. Subscribe https://t.co/MqPw2ZUctn
"8/ Still got questions? Our 2022 Voter Guide Can help. Build your ballot, get to know the candidates and see our recommendations at  ","Dallas, Texas",785,771406,dallasnews,2,2,truth,The official Dallas Morning News Twitter account. Subscribe https://t.co/MqPw2ZUctn
"7/ Want to vote by mail? Oct. 28 is the deadline to request a mail-in ballot for the Nov. 8 general election. The application must be received, not just postmarked, by that date. Here’s more info.
","Dallas, Texas",785,771406,dallasnews,5,5,truth,The official Dallas Morning News Twitter account. Subscribe https://t.co/MqPw2ZUctn
"6/ Not sure about your voter registration status? Check the @TXsecofstate’s website. If you moved to a different Texas county, you must register with your new county by Oct. 11. If you recently moved but stayed in the same county, update your address.  ","Dallas, Texas",785,771406,dallasnews,2,1,truth,The official Dallas Morning News Twitter account. Subscribe https://t.co/MqPw2ZUctn
5/ Another way to register is through the @TxDPS while renewing your driver’s license.  ,"Dallas, Texas",785,771406,dallasnews,0,1,truth,The official Dallas Morning News Twitter account. Subscribe https://t.co/MqPw2ZUctn
4/ You can also get paper registration applications at your local voter registrar or county election administrator's office. They’re also available at places like your local library.  ,"Dallas, Texas",785,771406,dallasnews,1,1,truth,The official Dallas Morning News Twitter account. Subscribe https://t.co/MqPw2ZUctn
"3/ There are different ways to register to vote. First, you can download and print a form from your county voter registrar.

In Dallas County, that’s the Dallas County Elections Administrator’s Office. It provides a printable application on its website.  ","Dallas, Texas",785,771406,dallasnews,1,1,truth,The official Dallas Morning News Twitter account. Subscribe https://t.co/MqPw2ZUctn
"2/ Here are the requirements to vote in Texas. Most notably, you must be a U.S. citizen and turn 18 years old by Election Day on Nov. 8.  ","Dallas, Texas",785,771406,dallasnews,0,1,truth,The official Dallas Morning News Twitter account. Subscribe https://t.co/MqPw2ZUctn
"1/ 📣 Tuesday, Oct. 11 is the deadline to register to vote in Texas. Voters will choose the next governor, lieutenant governor, attorney general and more in November.

If you aren't already registered to vote, here's what to know. 👇
","Dallas, Texas",785,771406,dallasnews,5,4,truth,The official Dallas Morning News Twitter account. Subscribe https://t.co/MqPw2ZUctn
"What to know about Biden’s marijuana pardons, including who’s eligible and who’s not ","Dallas, Texas",785,771406,dallasnews,1,2,truth,The official Dallas Morning News Twitter account. Subscribe https://t.co/MqPw2ZUctn
"This is how Micah Parsons does: Playing hurt, and impacting Cowboys victories 
","Dallas, Texas",785,771406,dallasnews,1,2,truth,The official Dallas Morning News Twitter account. Subscribe https://t.co/MqPw2ZUctn
Southlake Town Square attracts stores that once required a drive to Dallas ,"Dallas, Texas",785,771406,dallasnews,1,4,truth,The official Dallas Morning News Twitter account. Subscribe https://t.co/MqPw2ZUctn
Security costs for Texas Gov. Abbott’s second term? Nearly $1.4M - and counting ,"Dallas, Texas",785,771406,dallasnews,6,4,truth,The official Dallas Morning News Twitter account. Subscribe https://t.co/MqPw2ZUctn
We recommend in the race for Texas House District 114 | Opinion ,"Dallas, Texas",785,771406,dallasnews,0,0,truth,The official Dallas Morning News Twitter account. Subscribe https://t.co/MqPw2ZUctn
What’s on your ballot for the 2022 midterm elections in Texas? ,"Dallas, Texas",785,771406,dallasnews,1,5,truth,The official Dallas Morning News Twitter account. Subscribe https://t.co/MqPw2ZUctn
"Dallas Stars roster projection: Wyatt Johnston makes Opening Night squad after final cuts 
","Dallas, Texas",785,771406,dallasnews,1,0,truth,The official Dallas Morning News Twitter account. Subscribe https://t.co/MqPw2ZUctn
